product_id,product_name,category,price,stock_qty
21158,MOODY GIRL DOOR HANGER,General,3.36,1572
21165,BEWARE OF THE CAT METAL SIGN,General,4.21,4255
21174,POTTERING IN THE SHED METAL SIGN,General,4.21,4278
21189,WHITE HONEYCOMB PAPER GARLAND,General,3.36,451
21191,LARGE WHITE HONEYCOMB PAPER BELL,General,4.21,656
21195,PINK  HONEYCOMB PAPER BALL,General,4.21,788
21207,SKULL AND CROSSBONES  GARLAND,General,3.36,1166
21216,"SET 3 RETROSPOT TEA,COFFEE,SUGAR",General,11.02,2232
21217,RED RETROSPOT ROUND CAKE TINS,General,21.23,1188
21231,SWEETHEART CERAMIC TRINKET BOX,General,2.51,6159
21238,RED RETROSPOT CUP,General,1.66,4065
21249,WOODLAND  HEIGHT CHART STICKERS,General,5.91,823
21262,WHITE GOOSE FEATHER CHRISTMAS TREE,General,7.62,433
21313,GLASS HEART T-LIGHT HOLDER,General,1.66,3434
21349,IVY HEART WREATH,General,13.57,117
21352,EUCALYPTUS & PINECONE  WREATH,General,5.91,476
21354,TOAST ITS - BEST MUM,General,2.51,900
21365,MIRRORED WALL ART STARS,General,5.91,462
21366,MIRRORED WALL ART PHOTO FRAMES,General,8.47,188
21369,MIRRORED WALL ART SPLODGES,General,7.62,200
21372,MIRRORED WALL ART TABLE LAMP,General,5.91,174
21385,IVORY HANGING DECORATION  HEART,General,1.66,3987
21407,BROWN CHECK CAT DOORSTOP,General,8.47,388
21408,SPOTTY PINK DUCK DOORSTOP,General,8.47,388
21507,"ELEPHANT, BIRTHDAY CARD,",General,0.85,3431
21563,RED HEART SHAPE LOVE BUCKET,General,5.91,1493
21564,PINK  HEART SHAPE LOVE BUCKET,General,5.91,1140
21634,ASSORTED MINI MADRAS NOTEBOOK,General,2.51,1075
21641,ASSORTED TUTTI FRUTTI KEYRING BALL,General,1.66,1252
21679,SKULLS  STICKERS,General,1.66,1237
21703,BAG 125g SWIRLY MARBLES,General,0.85,9489
21704,BAG 250g SWIRLY MARBLES,General,1.66,5243
21721,CANDY SHOP  STICKER SHEET,General,1.66,294
21722,SWEET PUDDING STICKER SHEET,General,1.66,197
21758,VINTAGE SHELLS PRINT,General,12.72,149
79144B,PAINTED LIGHTBULB STAR+ MOON,General,0.42,279
22482,BLUE TEA TOWEL CLASSIC DESIGN,General,1.25,576
21917,SET 12 KIDS  WHITE CHALK STICKS,General,0.42,4255
20697,LITTLE GREEN MONSTER SOFT TOY,General,2.55,120
22599,CHRISTMAS MUSICAL ZINC STAR,General,0.85,2041
22597,CHRISTMAS MUSICAL ZINC HEART,General,0.85,2910
21495,SKULLS AND CROSSBONES WRAP,General,0.42,5875
46000R,POLYESTER FILLER PAD 45x30cm,General,1.45,201
46000S,POLYESTER FILLER PAD 40x40cm,General,1.45,1655
84920,PINK FLOWER FABRIC PONY,General,3.75,216
22953,BIRTHDAY PARTY CORDON BARRIER TAPE,General,1.25,601
84508A,CAMOUFLAGE DESIGN TEDDY,General,2.55,1730
21670,BLUE SPOT CERAMIC DRAWER KNOB,General,1.25,4464
22786,CUSHION COVER PINK UNION JACK,General,5.95,221
22212,FOUR HOOK  WHITE LOVEBIRDS,General,2.1,1714
22678,FRENCH BLUE METAL DOOR SIGN 3,General,1.25,941
22686,FRENCH BLUE METAL DOOR SIGN No,General,1.25,1092
84685,BEACH HUT KEY CABINET,General,3.75,133
20616,CHERRY BLOSSOM PASSPORT COVER,General,2.1,292
22753,SMALL YELLOW BABUSHKA NOTEBOOK,General,0.85,1102
79066K,RETRO MOD TRAY,General,0.85,882
22794,SWEETHEART WIRE MAGAZINE RACK,General,7.95,425
22592,CARDHOLDER HOLLY WREATH METAL,General,3.75,757
84352,SILVER CHRISTMAS TREE BAUBLE STAND,General,16.95,133
22795,SWEETHEART RECIPE BOOK STAND,General,6.75,1310
22278,OVERNIGHT BAG VINTAGE ROSE PAISLEY,General,4.95,505
22802,FAUX FUR CHOCOLATE THROW,General,19.95,183
84884A,ANT WHITE WIRE HEART SPIRAL,General,3.95,391
51014C,"FEATHER PEN,COAL BLACK",General,0.85,2787
51014L,"FEATHER PEN,LIGHT PINK",General,0.85,2159
51014A,"FEATHER PEN,HOT PINK",General,0.85,3978
22366,DOORMAT AIRMAIL,General,6.75,890
48111,DOORMAT 3 SMILEY CATS,General,6.75,1265
22846,BREAD BIN DINER STYLE RED,General,14.95,761
22402,MAGNETS PACK OF 4 VINTAGE COLLAGE,General,1.25,1811
22400,MAGNETS PACK OF 4 HOME SWEET HOME,General,1.25,1488
22399,MAGNETS PACK OF 4 CHILDHOOD MEMORY,General,1.25,1240
79302M,"ART LIGHTS,FUNK MONKEY",General,2.95,464
37446,MINI CAKE STAND WITH HANGING CAKES,General,1.45,1453
84509B,SET OF 4 FAIRY CAKE PLACEMATS,General,3.75,313
22313,OFFICE MUG WARMER PINK,General,2.95,659
21181,PLEASE ONE PERSON METAL SIGN,General,2.1,12393
21818,GLITTER CHRISTMAS HEART,General,0.85,2804
21668,RED STRIPE CERAMIC DRAWER KNOB,General,1.25,5622
21462,"NURSERY A,B,C PAINTED LETTERS",General,6.75,297
22496,SET OF 2 ROUND TINS DUTCH CHEESE,General,2.95,353
84870C,GREEN GEISHA GIRL,General,3.75,145
84870B,BLUE GEISHA GIRL,General,3.75,143
22765,NEWSPAPER STAND,General,14.95,126
21351,CINAMMON & ORANGE WREATH,General,6.75,202
22581,WOOD STOCKING CHRISTMAS SCANDISPOT,General,0.85,1668
22579,WOODEN TREE CHRISTMAS SCANDINAVIAN,General,0.85,5269
22572,ROCKING HORSE GREEN CHRISTMAS,General,0.85,1492
22640,SET OF 4 NAPKIN CHARMS 3 KEYS,General,2.55,337
22641,SET OF 4 NAPKIN CHARMS INSTRUMENT,General,2.55,237
22638,SET OF 4 NAPKIN CHARMS CROWNS,General,2.55,399
22576,SWALLOW WOODEN CHRISTMAS DECORATION,General,0.85,1636
21817,GLITTER CHRISTMAS TREE,General,0.85,1011
21813,GARLAND WITH STARS AND BELLS,General,4.95,648
21808,"CHRISTMAS GARLAND STARS,TREES",General,3.75,280
21014,SWISS CHALET TREE DECORATION,General,0.85,1483
21018,BIRD BOX CHRISTMAS TREE DECORATION,General,0.85,122
22946,WOODEN ADVENT CALENDAR CREAM,General,16.95,553
M,Manual,General,1.25,7323
22660,DOORMAT I LOVE LONDON,General,7.95,463
21761,WOOD AND GLASS MEDICINE CABINET,General,29.95,109
21781,MA CAMPAGNE CUTLERY BOX,General,14.95,267
22696,WICKER WREATH LARGE,General,1.95,825
84360,TABLE LAMP WHITE SHADE WOOD BASE,General,5.95,176
35954,SMALL FOLKART STAR CHRISTMAS DEC,General,0.42,1345
84760S,SMALL HANGING GLASS+ZINC LANTERN,General,1.45,131
85045,GREEN CHRISTMAS TREE STRING 20LIGHT,General,4.95,138
35598B,BLACK CHRISTMAS TREE 60CM,General,0.65,634
22578,WOODEN STAR CHRISTMAS SCANDINAVIAN,General,0.85,10538
22855,FINE WICKER HEART,General,1.25,2732
21864,UNION JACK FLAG PASSPORT COVER,General,1.69,857
15056P,EDWARDIAN PARASOL PINK,General,4.6,830
85174,S/4 CACTI CANDLES,General,4.25,701
82615,PINK MARSHMALLOW SCARF KNITTING KIT,General,2.55,100
85038,6 CHOCOLATE LOVE HEART T-LIGHTS,General,1.69,1093
22965,3 TRADITIONAL COOKIE CUTTERS  SET,General,2.1,1467
21374,MIRRORED WALL ART SKULLS,General,3.75,400
21509,COWBOYS AND INDIANS BIRTHDAY CARD,General,0.42,3829
22025,RING OF ROSES BIRTHDAY CARD,General,0.42,1935
22725,ALARM CLOCK BAKELIKE CHOCOLATE,General,3.75,2080
37448,CERAMIC CAKE DESIGN SPOTTED MUG,General,1.49,1544
22421,LIPSTICK PEN FUSCHIA,General,0.42,2686
84997A,GREEN 3 PIECE POLKADOT CUTLERY SET,General,3.75,2667
21136,PAINTED METAL PEARS ASSORTED,General,1.69,4801
71477,COLOUR GLASS. STAR T-LIGHT HOLDER,General,3.25,6846
22030,SWALLOWS GREETING CARD,General,0.42,5639
90214M,"LETTER ""M"" BLING KEY RING",General,1.25,159
90214V,"LETTER ""V"" BLING KEY RING",General,1.25,125
90214S,"LETTER ""S"" BLING KEY RING",General,1.25,193
21789,KIDS RAIN MAC PINK,General,0.85,1027
21629,SQUARE FLOOR CUSHION VINTAGE RED,General,7.95,172
21850,BLUE  DIAMANTE PEN IN GIFT BOX,General,4.95,229
20978,36 PENCILS TUBE SKULLS,General,1.25,1897
20768,GREEN FERN JOURNAL,General,2.55,276
20780,BLACK EAR MUFF HEADPHONES,General,5.49,147
21398,RED POLKADOT COFFEE  MUG,General,2.1,1631
21643,ASSORTED TUTTI FRUTTI MIRROR,General,1.25,647
21620,SET OF 4 ROSE BOTANICAL CANDLES,General,3.75,996
22260,FELT EGG COSY BLUE RABBIT,General,0.85,647
22136,LOVE HEART SOCK HANGER,General,1.65,478
10135,COLOURING PENCILS BROWN TUBE,General,2.51,2330
16168M,FUNKY MONKEY GIFT BAG MEDIUM,General,0.85,469
17014A,ORIGAMI VANILLA INCENSE CONES,General,3.36,254
17084N,FAIRY DREAMS INCENSE,General,0.43,1362
17084P,DRAGONS BLOOD INCENSE,General,0.43,522
20617,FIRST CLASS PASSPORT COVER,General,4.21,192
20619,TROPICAL PASSPORT COVER,General,4.21,361
20653,CHERRY BLOSSOM LUGGAGE TAG,General,2.51,172
20681,PINK POLKADOT CHILDRENS UMBRELLA,General,6.77,239
20682,RED RETROSPOT CHILDRENS UMBRELLA,General,6.77,1339
20696,FLORAL SOFT CAR TOY,General,7.62,153
20699,MOUSEY LONG LEGS SOFT TOY,General,5.06,195
20700,GREEN CAT FLORAL CUSHION COVER,General,10.17,172
20718,RED RETROSPOT SHOPPER BAG,General,2.51,4875
20752,BLUE POLKADOT WASHING UP GLOVES,General,4.21,513
20761,BLUE PAISLEY SKETCHBOOK,General,7.62,222
20846,ZINC HEART LATTICE T-LIGHT HOLDER,General,2.51,816
20931,BLUE POT PLANT CANDLE,General,7.62,397
21002,ROSE DU SUD DRAWSTRING BAG,General,3.36,223
21015,DARK BIRD HOUSE TREE DECORATION,General,1.28,1584
21067,VINTAGE RED TEATIME MUG,General,2.51,418
21109,"LARGE CAKE TOWEL, CHOCOLATE SPOTS",General,13.57,1036
21110,LARGE CAKE TOWEL PINK SPOTS,General,13.57,1204
21128,GOLD FISHING GNOME,General,12.72,167
21164,HOME SWEET HOME METAL SIGN,General,5.91,1867
21188,3D HEARTS  HONEYCOMB PAPER GARLAND,General,5.91,424
21208,PASTEL COLOUR HONEYCOMB FAN,General,3.36,1039
21220,SET/4 BADGES DOGS,General,2.51,447
21272,SALLE DE BAIN HOOK,General,2.51,652
21279,VINTAGE KITCHEN PRINT FRUITS,General,5.06,184
21281,VINTAGE KITCHEN PRINT SEAFOOD,General,5.06,142
21288,STRIPEY CHOCOLATE NESTING BOXES,General,5.91,457
21356,TOAST ITS - FAIRY FLOWER,General,2.51,742
21439,BASKET OF TOADSTOOLS,General,2.51,1529
21447,12 IVORY ROSE PEG PLACE SETTINGS,General,2.51,1068
21537,RED RETROSPOT PUDDING BOWL,General,8.47,431
21547,CERAMIC BIRDHOUSE CRESTED TIT SMALL,General,5.91,178
21594,Dr. Jam's Arouzer Stress Ball,General,4.21,101
21638,ASSORTED TUTTI FRUTTI NOTEBOOK,General,4.21,348
21648,ASSORTED TUTTI FRUTTI SMALL PURSE,General,2.51,834
21656,RIDGED GLASS POSY VASE,General,3.36,318
21671,RED SPOT CERAMIC DRAWER KNOB,General,2.51,4519
21684,SMALL MEDINA STAMPED METAL BOWL,General,2.51,882
21698,MOCK LOBSTER FRIDGE MAGNET,General,1.66,395
21700,BIG DOUGHNUT FRIDGE MAGNETS,General,8.47,1825
21745,GAOLERS KEYS DECORATIVE GARDEN,General,8.47,1037
21775,DECORATIVE FLORE BATHROOM BOTTLE,General,2.51,612
21820,GLITTER HEART GARLAND WITH BELLS,General,7.62,431
21830,ASSORTED CREEPY CRAWLIES,General,0.85,2768
21846,PINK DIAMANTE PEN IN GIFT BOX,General,4.21,520
21868,POTTING SHED TEA MUG,General,3.36,2577
21875,KINGS CHOICE MUG,General,3.36,2154
21896,POTTING SHED TWINE,General,4.21,1082
21899,"KEY FOB , GARAGE DESIGN",General,1.66,2783
21906,PHARMACIE FIRST AID TIN,General,13.57,680
21908,CHOCOLATE THIS WAY METAL SIGN,General,4.21,3872
21974,SET OF 36 PAISLEY FLOWER DOILIES,General,2.98,2314
22078,RIBBON REEL LACE DESIGN,General,4.21,1480
22084,PAPER CHAIN KIT EMPIRE,General,5.91,5288
22091,EMPIRE TISSUE BOX,General,2.51,2089
22124,SET OF 2 TEA TOWELS PING MICROWAVE,General,2.51,248
22165,"DIAMANTE HEART SHAPED WALL MIRROR,",General,11.02,514
22184,CAKE STAND VICTORIAN FILIGREE LARGE,General,8.47,155
22208,WOOD STAMP SET THANK YOU,General,3.36,1614
22245,"HOOK, 1 HANGER ,MAGIC GARDEN",General,1.66,1361
22246,MAGIC GARDEN FELT GARLAND,General,4.21,529
22283,6 EGG HOUSE PAINTED WOOD,General,16.13,400
22304,COFFEE MUG BLUE PAISLEY DESIGN,General,5.06,866
22308,TEA COSY BLUE STRIPE,General,5.06,349
22317,FIVE CATS HANGING DECORATION,General,5.91,385
22324,BLUE POLKADOT KIDS BAG,General,4.21,385
22325,MOBILE VINTAGE HEARTS,General,11.87,349
22331,WOODLAND PARTY BAG + STICKER SET,General,3.36,1939
22342,HOME GARLAND PAINTED ZINC,General,3.36,1096
22350,ILLUSTRATED CAT BOWL,General,5.06,1508
22393,PAPERWEIGHT VINTAGE COLLAGE,General,5.06,611
22405,MONEY BOX POCKET MONEY DESIGN,General,2.51,473
22409,MONEY BOX BISCUITS DESIGN,General,2.51,327
22420,LIPSTICK PEN BABY PINK,General,0.85,1432
22425,ENAMEL COLANDER CREAM,General,10.17,559
22458,CAST IRON HOOK GARDEN FORK,General,5.06,622
22459,CAST IRON HOOK GARDEN TROWEL,General,5.06,485
22499,WOODEN UNION JACK BUNTING,General,12.72,2190
22503,CABIN BAG VINTAGE PAISLEY,General,59.53,198
22536,MAGIC DRAWING SLATE PURDEY,General,0.85,4854
22586,FELTCRAFT HAIRBAND PINK AND BLUE,General,1.66,955
22602,CHRISTMAS RETROSPOT HEART WOOD,General,1.66,2316
22649,STRAWBERRY FAIRY CAKE TEAPOT,General,11.02,896
22668,PINK BABY BUNTING,General,5.91,2289
22673,FRENCH GARDEN SIGN BLUE METAL,General,2.51,893
22692,DOORMAT WELCOME TO OUR HOME,General,7.95,1623
22746,POPPY'S PLAYHOUSE LIVINGROOM,General,4.21,1549
22747,POPPY'S PLAYHOUSE BATHROOM,General,4.21,1056
22756,LARGE YELLOW BABUSHKA NOTEBOOK,General,2.51,698
22788,BROCANTE COAT RACK,General,20.38,319
22831,WHITE BROCANTE SOAP DISH,General,5.91,805
22841,ROUND CAKE TIN VINTAGE GREEN,General,16.13,629
22863,SOAP DISH BROCANTE,General,5.91,820
22870,NUMBER TILE COTTAGE GARDEN 2,General,4.21,193
22890,NOVELTY BISCUITS CAKE STAND 3 TIER,General,20.38,490
22897,OVEN MITT APPLES DESIGN,General,2.98,1451
22898,CHILDRENS APRON APPLES DESIGN,General,4.21,2524
22944,CHRISTMAS METAL POSTCARD WITH BELLS,General,16.13,3474
22977,DOLLY GIRL CHILDRENS EGG CUP,General,2.51,1050
35637A,IVORY STRING CURTAIN WITH POLE,General,19.53,269
35916B,BLUE FELT HANGING HEART W FLOWER,General,1.66,190
35916C,PINK FELT HANGING HEART W FLOWER,General,1.66,205
35964,FOLKART CLIP ON STARS,General,1.66,885
35965,FOLKART HEART NAPKIN RINGS,General,3.36,462
35967,FOLK ART METAL STAR T-LIGHT HOLDER,General,1.66,582
37450,CERAMIC CAKE BOWL + HANGING CAKES,General,5.91,816
37491A,YELLOW/PINK CERAMIC CANDLE HOLDER,General,3.36,105
46775D,SUNSET COLOUR CHUNKY KNITTED THROW,General,11.02,159
46776B,WOVEN BERRIES CUSHION COVER,General,4.21,260
47566B,TEA TIME PARTY BUNTING,General,8.47,2481
47567B,TEA TIME KITCHEN APRON,General,12.72,708
47590A,BLUE HAPPY BIRTHDAY BUNTING,General,11.02,2091
47590B,PINK HAPPY BIRTHDAY BUNTING,General,11.02,2426
47594A,CAROUSEL DESIGN WASHBAG,General,4.21,207
70006,LOVE HEART POCKET WARMER,General,3.36,2801
71496A,A4 WALL TIDY BLUE OFFICE,General,1.49,225
72134,COLUMBIAN  CUBE CANDLE,General,1.66,204
79067,CORONA MEXICAN TRAY,General,8.47,271
82582,AREA PATROLLED METAL SIGN,General,4.21,4466
82599,FANNY'S REST STOPMETAL SIGN,General,4.21,606
82616C,MIDNIGHT GLAMOUR SCARF KNITTING KIT,General,2.51,423
84459B,YELLOW METAL CHICKEN HEART,General,3.36,820
84520B,PACK 20 ENGLISH ROSE PAPER NAPKINS,General,1.66,652
84559A,3D SHEET OF DOG STICKERS,General,1.69,496
84559B,3D SHEET OF CAT STICKERS,General,1.69,336
84596J,MIXED NUTS LIGHT GREEN BOWL,General,2.51,667
84609,TALL ROCOCO CANDLE HOLDER,General,16.98,192
84659A,WHITE TRAVEL ALARM CLOCK,General,2.51,377
84663A,GRASS HOPPER WOODEN WALL CLOCK,General,5.91,371
84828,JUNGLE POPSICLES ICE LOLLY HOLDERS,General,2.51,1201
84856L,LARGE TAHITI BEACH BAG,General,11.87,101
84915,HAND TOWEL PINK FLOWER AND DAISY,General,4.21,315
84950,ASSORTED COLOUR T-LIGHT HOLDER,General,0.99,3713
84976,RECTANGULAR SHAPED MIRROR,General,3.36,611
85008,SET OF 3 CONEY ISLAND OVAL BOXES,General,10.17,112
85040B,SET/4 BLUE FLOWER CANDLES IN BOWL,General,3.36,235
85053,FRENCH ENAMEL CANDLEHOLDER,General,4.21,1800
85114A,BLACK ENCHANTED FOREST PLACEMAT,General,3.36,745
85131D,BEADED CRYSTAL HEART PINK ON STICK,General,0.85,949
85170D,SET/6 PINK BIRD T-LIGHT CANDLES,General,4.21,550
85212,MINI PAINTED GARDEN DECORATION,General,1.66,2572
85227,SET OF 6 3D KIT CARDS FOR KIDS,General,1.66,1586
85232D,SET/3 DECOUPAGE STACKING TINS,General,10.17,293
90013B,BLACK VINTAGE EARRINGS,General,4.24,135
90018B,GOLD M.O.P ORBIT DROP EARRINGS,General,4.24,121
90019B,GOLD M.O.P ORBIT BRACELET,General,5.51,117
90024C,NEW BAROQUE B'FLY NECKLACE GREEN,General,8.49,103
90036F,"FLOWER GLASS GARLD NECKL36""TURQUOIS",General,8.07,107
90040B,MURANO STYLE GLASS BRACELET BLACK,General,3.81,117
90051,CRACKED GLAZE NECKLACE RED,General,7.22,109
90054,CRACKED GLAZE EARRINGS RED,General,2.54,108
90077,BLACK DIAMOND CLUSTER EARRINGS,General,2.96,102
90124B,BLUE MURANO TWIST NECKLACE,General,10.17,111
90134,OLD ROSE COMBO BEAD NECKLACE,General,2.96,153
90138,WHITE/PINK MINI CRYSTALS NECKLACE,General,5.51,109
90161B,ANT COPPER TURQ BOUDICCA BRACELET,General,5.09,174
90166,PINK & WHITE ROSEBUD RING,General,4.24,120
90173,PAIR BUTTERFLY HAIR CLIPS,General,3.81,131
90177C,DROP DIAMANTE EARRINGS CRYSTAL,General,2.96,125
90177E,DROP DIAMANTE EARRINGS GREEN,General,2.96,113
90181B,AMETHYST GLASS/SHELL/PEARL NECKLACE,General,9.34,114
90192,JADE DROP EARRINGS W FILIGREE,General,5.09,141
90206C,CRYSTAL DIAMANTE STAR BROOCH,General,5.09,145
90209C,PINK ENAMEL+GLASS HAIR COMB,General,2.11,362
90211A,DIAMOND LAS VEGAS NECKLACE 45CM,General,5.94,111
90214A,"LETTER ""A"" BLING KEY RING",General,0.85,228
90214E,"LETTER ""E"" BLING KEY RING",General,0.85,171
20970,PINK FLORAL FELTCRAFT SHOULDER BAG,General,3.75,1214
84658,WHITE STITCHED CUSHION COVER,General,6.95,156
22448,PIN CUSHION BABUSHKA RED,General,3.35,298
22447,PIN CUSHION BABUSHKA BLUE,General,3.35,234
22446,PIN CUSHION BABUSHKA PINK,General,3.35,536
20665,RED RETROSPOT PURSE,General,2.95,558
21472,LADYBIRD + BEE RAFFIA FOOD COVER,General,3.75,217
21877,HOME SWEET HOME MUG,General,1.25,5517
22524,CHILDRENS GARDEN GLOVES BLUE,General,1.25,741
20765,CHRYSANTHEMUM SKETCHBOOK,General,3.75,202
21624,VINTAGE UNION JACK DOORSTOP,General,5.95,316
84926A,WAKE UP COCKEREL TILE COASTER,General,1.25,700
85035C,ROSE 3 WICK MORRIS BOX CANDLE,General,4.25,1251
72803A,ROSE SCENT CANDLE JEWELLED DRAWER,General,4.25,630
40001,WHITE BAMBOO RIBS LAMPSHADE,General,0.85,917
21709,FOLDING UMBRELLA CHOCOLATE POLKADOT,General,4.95,232
22220,CAKE STAND LOVEBIRD 2 TIER WHITE,General,9.95,331
85034A,3 GARDENIA MORRIS BOXED CANDLES,General,4.25,600
72798C,SET/4 GARDEN ROSE DINNER CANDLE,General,1.65,106
35271S,GOLD PRINT PAPER BAG,General,0.19,105
21380,WOODEN HAPPY BIRTHDAY GARLAND,General,2.95,2267
21221,SET/4 BADGES CUTE CREATURES,General,1.25,356
20755,BLUE PAISLEY POCKET BOOK,General,0.85,401
21421,PORCELAIN ROSE LARGE,General,1.25,387
21422,PORCELAIN ROSE SMALL,General,0.85,1691
22617,BAKING SET SPACEBOY DESIGN,General,4.25,2285
21364,PEACE SMALL WOOD LETTERS,General,6.75,128
21042,RED RETROSPOT APRON,General,5.95,432
22272,FELTCRAFT DOLL MARIA,General,2.95,290
21172,PARTY METAL SIGN,General,1.45,3578
72760B,VINTAGE CREAM 3 BASKET CAKE STAND,General,9.95,508
22365,DOORMAT RESPECTABLE HOUSE,General,7.95,888
22507,MEMO BOARD RETROSPOT  DESIGN,General,4.95,3056
62096A,PINK/YELLOW FLOWERS HANDBAG,General,1.25,200
85071D,CHARLIE+LOLA MY ROOM DOOR SIGN,General,2.55,497
22044,CHRISTMAS CARD STACK OF PRESENTS,General,0.42,904
21918,SET 12 KIDS COLOUR  CHALK STICKS,General,0.42,7276
22029,SPACEBOY BIRTHDAY CARD,General,0.42,8273
21360,JOY LARGE WOOD LETTERS,General,9.95,138
84077,WORLD WAR 2 GLIDERS ASSTD DESIGNS,General,0.29,55099
84792,ENCHANTED BIRD COATHANGER 5 HOOK,General,4.65,926
85175,CACTI T-LIGHT CANDLES,General,0.42,5357
20893,HANGING BAUBLE T-LIGHT HOLDER SMALL,General,2.1,269
22440,BALLOON WATER BOMB PACK OF 35,General,0.42,6094
22434,BALLOON PUMP WITH 10 BALLOONS,General,1.95,882
22564,ALPHABET STENCIL CRAFT,General,1.25,2790
21215,IVORY PAPER CUP CAKE CASES,General,0.42,1089
21058,PARTY INVITES WOODLAND,General,0.85,1245
21060,PARTY INVITES BALLOON GIRL,General,0.85,493
21719,LOVELY BONBON STICKER SHEET,General,0.85,433
84826,ASSTD DESIGN 3D PAPER STICKERS,General,0.85,1205
21881,CUTE CATS TAPE,General,0.65,1190
22491,PACK OF 12 COLOURED PENCILS,General,0.85,4035
21355,TOAST ITS - I LOVE YOU,General,1.25,870
21518,BANK ACCOUNT  GREETING  CARD,General,0.42,406
22023,EMPIRE BIRTHDAY CARD,General,0.42,1306
22027,TEA PARTY BIRTHDAY CARD,General,0.42,4480
22718,CARD CAT AND TREE,General,0.42,1733
22717,CARD DOG AND BALL,General,0.42,1317
22028,PENNY FARTHING BIRTHDAY CARD,General,0.42,3142
21669,BLUE STRIPE CERAMIC DRAWER KNOB,General,1.25,5373
21673,WHITE SPOT BLUE CERAMIC DRAWER KNOB,General,1.25,4483
22460,EMBOSSED GLASS TEALIGHT HOLDER,General,1.25,2635
22433,WATERING CAN GREEN DINOSAUR,General,1.95,1488
22431,WATERING CAN BLUE ELEPHANT,General,1.95,2154
84674,FLYING PIG WATERING CAN,General,2.95,288
22676,FRENCH BLUE METAL DOOR SIGN 1,General,1.25,1247
22672,FRENCH BATHROOM SIGN BLUE METAL,General,1.65,1564
22777,GLASS BELL JAR LARGE,General,8.5,450
22924,FRIDGE MAGNETS LA VIE EN ROSE,General,0.85,1401
22832,BROCANTE SHELF WITH HOOKS,General,10.75,258
20674,GREEN POLKADOT BOWL,General,1.25,1664
22170,PICTURE FRAME WOOD TRIPLE PORTRAIT,General,6.75,1165
21428,SET3 BOOK BOX GREEN GINGHAM FLOWER,General,4.25,1300
22840,ROUND CAKE TIN VINTAGE RED,General,7.95,1012
79191C,RETRO PLASTIC ELEPHANT TRAY,General,0.85,1204
47471,RAINBOW PEGS PHOTO CLIP STRING,General,0.65,391
16046,TEATIME PEN CASE & PENS,General,0.85,167
22796,PHOTO FRAME 3 CLASSIC HANGING,General,9.95,682
22733,3D TRADITIONAL CHRISTMAS STICKERS,General,1.25,1679
22559,SEASIDE FLYING DISC,General,1.25,604
22896,PEG BAG APPLES DESIGN,General,2.55,1691
20967,GREY FLORAL FELTCRAFT SHOULDER BAG,General,3.75,365
21430,SET/3 RED GINGHAM ROSE STORAGE BOX,General,3.75,3136
22070,SMALL RED RETROSPOT MUG IN BOX,General,3.75,1043
20983,12 PENCILS TALL TUBE RED RETROSPOT,General,0.85,2834
21527,RED RETROSPOT TRADITIONAL TEAPOT,General,7.95,579
21538,DAIRY MAID  PUDDING BOWL,General,3.75,101
85216,ASSORTED CAKES FRIDGE MAGNETS,General,0.65,143
22131,FOOD CONTAINER SET 3 LOVE HEART,General,1.95,2133
21163,DO NOT TOUCH MY STUFF DOOR HANGER,General,1.45,1289
21161,KEEP OUT BOYS DOOR HANGER,General,1.45,232
21159,MOODY BOY  DOOR HANGER,General,1.45,1215
21390,FILIGRIS HEART WITH BUTTERFLY,General,1.25,3982
22285,"DECORATION HEN ON NEST, HANGING",General,1.65,959
22284,HEN HOUSE DECORATION,General,1.65,1042
21383,PACK OF 12 STICKY BUNNIES,General,0.65,1086
21381,MINI WOODEN HAPPY BIRTHDAY GARLAND,General,1.69,1903
22210,WOOD STAMP SET BEST WISHES,General,1.65,1107
22209,WOOD STAMP SET HAPPY BIRTHDAY,General,1.65,1038
21872,GLAMOROUS  MUG,General,1.25,1384
85035A,GARDENIA 3 WICK MORRIS BOXED CANDLE,General,4.25,378
22761,CHEST 7 DRAWER MA CAMPAGNE,General,24.95,135
22385,JUMBO BAG SPACEBOY DESIGN,General,1.95,8767
22374,AIRLINE BAG VINTAGE JET SET RED,General,4.25,647
21741,COSY SLIPPER SHOES LARGE GREEN,General,2.95,241
85061W,WHITE JEWELLED HEART DECORATION,General,0.85,2240
40016,CHINESE DRAGON PAPER LANTERNS,General,0.42,5556
22202,MILK PAN PINK POLKADOT,General,3.75,162
21064,BOOM BOX SPEAKER BOYS,General,5.95,400
84341B,SMALL PINK MAGIC CHRISTMAS TREE,General,0.85,744
84509G,SET OF 4 FAIRY CAKE PLACEMATS,General,3.75,615
16235,RECYCLED PENCIL WITH RABBIT ERASER,General,0.21,3156
20986,BLUE CALCULATOR RULER,General,1.25,753
20832,RED FLOCK LOVE HEART PHOTO FRAME,General,0.85,1187
84846A,SCENTED CANDLE IN DIGITALIS TIN,General,2.1,151
22442,GROW YOUR OWN FLOWERS SET OF 3,General,7.95,394
21769,VINTAGE POST OFFICE CABINET,General,79.95,110
20798,CLEAR MILKSHAKE GLASS,General,2.1,124
22320,BIRDS MOBILE VINTAGE DESIGN,General,5.95,286
21561,DINOSAUR LUNCH BOX WITH CUTLERY,General,2.55,1375
85132B,CHARLIE AND LOLA TABLE TINS,General,9.95,628
85132C,CHARLIE AND LOLA FIGURES TINS,General,9.95,1619
22215,CAKE STAND WHITE TWO TIER LACE,General,8.5,441
20675,BLUE POLKADOT BOWL,General,1.25,3213
21239,PINK  POLKADOT CUP,General,0.85,3110
21987,PACK OF 6 SKULL PAPER CUPS,General,0.65,2201
21988,PACK OF 6 SKULL PAPER PLATES,General,0.85,2409
21989,PACK OF 20 SKULL PAPER NAPKINS,General,0.85,2500
22316,200 BENDY SKULL STRAWS,General,1.25,749
22332,SKULLS PARTY BAG + STICKER SET,General,1.65,1125
21206,STRAWBERRY HONEYCOMB  GARLAND,General,1.65,1378
20677,PINK POLKADOT BOWL,General,1.25,3768
22806,SET OF 6 T-LIGHTS WEDDING CAKE,General,2.95,354
22893,MINI CAKE STAND T-LIGHT HOLDER,General,0.42,1948
85159A,"BLACK TEA,COFFEE,SUGAR JARS",General,6.35,551
21784,SHOE SHINE BOX,General,9.95,155
22849,BREAD BIN DINER STYLE MINT,General,16.95,424
17090D,VANILLA INCENSE 40 CONES IN TIN,General,1.25,123
17090A,LAVENDER INCENSE 40 CONES IN TIN,General,1.25,203
72127,COLUMBIAN CANDLE ROUND,General,1.25,263
72133,COLUMBIAN CANDLE RECTANGLE,General,1.25,139
84763,ZINC FINISH 15CM PLANTER POTS,General,1.25,689
22450,SILK PURSE BABUSHKA BLUE,General,3.35,294
10124G,ARMY CAMO BOOKCOVER TAPE,General,0.42,112
84519B,CARROT CHARLIE+LOLA COASTER SET,General,2.95,570
22505,MEMO BOARD COTTAGE DESIGN,General,4.95,1560
22514,CHILDS GARDEN SPADE BLUE,General,2.1,400
21504,SKULLS GREETING CARD,General,0.42,2003
22292,HANGING CHICK  YELLOW DECORATION,General,1.45,1238
21211,SET OF 72 SKULL PAPER  DOILIES,General,1.45,983
22045,SPACEBOY GIFT WRAP,General,0.42,6627
90175C,BLUE GLASS CHUNKY CHARM BRACELET,General,8.95,108
90180A,BLACK+WHITE NECKLACE W TASSEL,General,9.95,116
90178A,AMBER CHUNKY GLASS+BEAD NECKLACE,General,11.95,107
22986,GINGHAM ROSE WRAP,General,0.42,4180
20984,12 PENCILS TALL TUBE POSY,General,0.85,3910
22436,12 COLOURED PARTY BALLOONS,General,0.65,2245
21465,PINK FLOWER CROCHET FOOD COVER,General,3.75,336
21470,FLOWER VINE RAFFIA FOOD COVER,General,3.75,482
16012,FOOD/DRINK SPONGE STICKERS,General,0.21,1320
85025C,PINK HEART SHAPE PHOTO FRAME,General,1.65,420
21849,SILVER DIAMANTE PEN IN GIFT BOX,General,4.95,274
85124B,BLUE JUICY FRUIT PHOTO FRAME,General,2.55,192
85124C,GREEN JUICY FRUIT PHOTO FRAME,General,2.55,193
20828,GLITTER BUTTERFLY CLIPS,General,2.55,1228
21623,VINTAGE UNION JACK MEMOBOARD,General,9.95,3370
16156S,WRAP PINK FAIRY CAKES,General,0.42,5875
85049F,BABY BOOM RIBBONS,General,1.25,475
22426,ENAMEL WASH BOWL CREAM,General,3.75,839
90082D,DIAMANTE BOW BROOCH BLACK COLOUR,General,6.35,106
90082A,DIAMANTE BOW BROOCH GREEN COLOUR,General,6.35,125
90082B,DIAMANTE BOW BROOCH RED COLOUR,General,6.35,122
90081A,LILY BROOCH AMETHYST COLOUR,General,4.95,114
90204,PAIR OF ENAMEL BUTTERFLY HAIRCLIP,General,3.35,128
90185B,AMETHYST DIAMANTE EXPANDABLE RING,General,4.25,122
90195A,PURPLE GEMSTONE BRACELET,General,8.95,118
90195B,BLACK GEMSTONE BRACELET,General,8.95,103
90196A,PURPLE GEMSTONE NECKLACE 45CM,General,12.75,107
90199A,5 STRAND GLASS NECKLACE BLACK,General,6.35,109
90186A,AMETHYST HOOP EARRING FLORAL LEAF,General,2.95,111
20894,HANGING BAUBLE T-LIGHT HOLDER LARGE,General,2.95,130
85106,CUT GLASS HEXAGON T-LIGHT HOLDER,General,2.55,749
21415,CLAM SHELL SMALL,General,2.1,321
21416,CLAM SHELL LARGE,General,3.75,104
21417,COCKLE SHELL DISH,General,2.1,439
22343,PARTY PIZZA DISH RED RETROSPOT,General,0.85,2071
22474,SPACEBOY TV DINNER TRAY,General,4.95,402
18097A,PINK TALL PORCELAIN T-LIGHT HOLDER,General,2.55,104
18097C,WHITE TALL PORCELAIN T-LIGHT HOLDER,General,2.55,798
