product_id,product_name,category,price,stock_qty
85123A,WHITE HANGING HEART T-LIGHT HOLDER,General,2.55,37754
71053,WHITE METAL LANTERN,General,3.39,2044
84406B,CREAM CUPID HEARTS COAT HANGER,General,2.75,2108
84029G,KNITTED UNION FLAG HOT WATER BOTTLE,General,3.39,3417
84029E,RED WOOLLY HOTTIE WHITE HEART.,General,3.39,4859
22752,SET 7 BABUSHKA NESTING BOXES,General,7.65,1888
21730,GLASS STAR FROSTED T-LIGHT HOLDER,General,4.25,612
22633,HAND WARMER UNION JACK,General,1.85,4961
22632,HAND WARMER RED POLKA DOT,General,1.85,4568
84879,ASSORTED COLOUR BIRD ORNAMENT,General,1.69,36529
22745,POPPY'S PLAYHOUSE BEDROOM,General,2.1,2123
22748,POPPY'S PLAYHOUSE KITCHEN,General,2.1,2219
22749,FELTCRAFT PRINCESS CHARLOTTE DOLL,General,3.75,2467
22310,IVORY KNITTED MUG COSY,General,1.65,762
84969,BOX OF 6 ASSORTED COLOUR TEASPOONS,General,4.25,652
22623,BOX OF VINTAGE JIGSAW BLOCKS,General,4.95,1036
22622,BOX OF VINTAGE ALPHABET BLOCKS,General,9.95,1440
21754,HOME BUILDING BLOCK WORD,General,5.95,2877
21755,LOVE BUILDING BLOCK WORD,General,5.95,2131
21777,RECIPE BOX WITH METAL HEART,General,7.95,108
48187,DOORMAT NEW ENGLAND,General,7.95,3926
22960,JAM MAKING SET WITH JARS,General,4.25,8800
22913,RED COAT RACK PARIS FASHION,General,4.95,449
22912,YELLOW COAT RACK PARIS FASHION,General,4.95,384
22914,BLUE COAT RACK PARIS FASHION,General,4.95,565
21756,BATH BUILDING BLOCK WORD,General,5.95,920
22728,ALARM CLOCK BAKELIKE PINK,General,3.75,5440
22727,ALARM CLOCK BAKELIKE RED,General,3.75,7891
22726,ALARM CLOCK BAKELIKE GREEN,General,3.75,6518
21724,PANDA AND BUNNIES STICKER SHEET,General,0.85,496
21883,STARS GIFT TAPE,General,0.65,1729
10002,INFLATABLE POLITICAL GLOBE,General,0.85,912
21791,VINTAGE HEADS AND TAILS CARD GAME,General,1.25,7965
21035,SET/2 RED RETROSPOT TEA TOWELS,General,2.95,2685
22326,ROUND SNACK BOXES SET OF4 WOODLAND,General,2.95,8636
22629,SPACEBOY LUNCH BOX,General,1.95,14336
22659,LUNCH BOX I LOVE LONDON,General,1.95,11599
22631,CIRCUS PARADE LUNCH BOX,General,1.95,3757
22661,CHARLOTTE BAG DOLLY GIRL DESIGN,General,0.85,5294
21731,RED TOADSTOOL LED NIGHT LIGHT,General,1.65,14085
22900,SET 2 TEA TOWELS I LOVE LONDON,General,2.95,4995
21913,VINTAGE SEASIDE JIGSAW PUZZLES,General,3.75,486
22540,MINI JIGSAW CIRCUS PARADE,General,0.42,2595
22544,MINI JIGSAW SPACEBOY,General,0.42,4597
22492,MINI PAINT SET VINTAGE,General,0.65,26697
POST,POSTAGE,General,18.0,3247
22086,PAPER CHAIN KIT 50'S CHRISTMAS,General,2.55,19375
20679,EDWARDIAN PARASOL RED,General,4.95,1804
37370,RETRO COFFEE MUGS ASSORTED,General,1.06,2665
21871,SAVE THE PLANET MUG,General,1.06,5548
21071,VINTAGE BILLBOARD DRINK ME MUG,General,1.06,1089
21068,VINTAGE BILLBOARD LOVE/HATE MUG,General,1.06,1732
82483,WOOD 2 DRAWER CABINET WHITE FINISH,General,4.95,2501
82486,WOOD S/3 CABINET ANT WHITE FINISH,General,6.95,2246
82482,WOODEN PICTURE FRAME WHITE FINISH,General,2.1,9100
82494L,WOODEN FRAME ANTIQUE WHITE,General,2.55,6843
21258,VICTORIAN SEWING BOX LARGE,General,10.95,600
22114,HOT WATER BOTTLE TEA AND SYMPATHY,General,3.45,5799
21733,RED HANGING HEART T-LIGHT HOLDER,General,2.55,7918
22386,JUMBO BAG PINK POLKADOT,General,1.95,21555
85099C,JUMBO  BAG BAROQUE BLACK WHITE,General,1.95,14012
21033,JUMBO BAG CHARLIE AND LOLA TOYS,General,2.95,2023
20723,STRAWBERRY CHARLOTTE BAG,General,0.85,9888
84997B,RED 3 PIECE RETROSPOT CUTLERY SET,General,3.75,4302
84997C,BLUE 3 PIECE POLKADOT CUTLERY SET,General,3.75,3878
21094,SET/6 RED SPOTTY PAPER PLATES,General,0.85,8846
20725,LUNCH BAG RED RETROSPOT,General,1.65,19643
21559,STRAWBERRY LUNCH BOX WITH CUTLERY,General,2.55,4032
22352,LUNCH BOX WITH CUTLERY RETROSPOT,General,2.55,3187
21212,PACK OF 72 RETROSPOT CAKE CASES,General,0.42,36419
21975,PACK OF 60 DINOSAUR CAKE CASES,General,0.55,12416
21977,PACK OF 60 PINK PAISLEY CAKE CASES,General,0.55,24930
84991,60 TEATIME FAIRY CAKE CASES,General,0.55,18290
84519A,TOMATO CHARLIE+LOLA COASTER SET,General,2.95,606
85183B,CHARLIE & LOLA WASTEPAPER BIN FLORA,General,1.25,1048
85071B,RED CHARLIE+LOLA PERSONAL DOORSIGN,General,0.38,1305
21931,JUMBO STORAGE BAG SUKI,General,1.95,13744
21929,JUMBO BAG PINK VINTAGE PAISLEY,General,1.95,11097
22961,JAM MAKING SET PRINTED,General,1.45,16488
22139,RETROSPOT TEA SET CERAMIC 11 PC,General,4.25,4604
84854,GIRLY PINK TOOL SET,General,4.95,100
22411,JUMBO SHOPPER VINTAGE RED PAISLEY,General,1.95,12692
82567,"AIRLINE LOUNGE,METAL SIGN",General,2.1,811
21672,WHITE SPOT RED CERAMIC DRAWER KNOB,General,1.25,5116
22774,RED DRAWER KNOB ACRYLIC EDWARDIAN,General,1.25,2354
22771,CLEAR DRAWER KNOB ACRYLIC EDWARDIAN,General,1.25,6711
71270,PHOTO CLIP LINE,General,1.25,338
22262,FELT EGG COSY CHICKEN,General,0.85,1126
22637,PIGGY BANK RETROSPOT,General,2.55,2863
21934,SKULL SHOULDER BAG,General,1.65,2511
21169,YOU'RE CONFUSING ME METAL SIGN,General,1.69,4521
21166,COOK WITH WINE METAL SIGN,General,1.95,10463
21175,GIN + TONIC DIET METAL SIGN,General,2.1,12323
37444A,YELLOW BREAKFAST CUP AND SAUCER,General,2.95,154
37444C,PINK BREAKFAST CUP AND SAUCER,General,2.95,122
22083,PAPER CHAIN KIT RETROSPOT,General,2.95,4757
84971S,SMALL HEART FLOWERS HOOK,General,0.85,1880
47580,TEA TIME DES TEA COSY,General,2.55,488
22261,FELT EGG COSY WHITE RABBIT,General,0.85,684
84832,ZINC WILLIE WINKIE  CANDLE STICK,General,0.85,3033
22644,CERAMIC CHERRY CAKE MONEY BANK,General,1.45,2322
21533,RETROSPOT LARGE MILK JUG,General,4.95,1460
21557,SET OF 6 FUNKY BEAKERS,General,2.95,649
15056BL,EDWARDIAN PARASOL BLACK,General,5.95,2942
15056N,EDWARDIAN PARASOL NATURAL,General,5.95,4052
22646,CERAMIC STRAWBERRY CAKE MONEY BANK,General,1.45,4264
22176,BLUE OWL SOFT TOY,General,2.95,612
22438,BALLOON ART MAKE YOUR OWN FLOWERS,General,1.95,1121
22778,GLASS CLOCHE SMALL,General,3.95,905
22719,GUMBALL MONOCHROME COAT RACK,General,1.06,684
21523,DOORMAT FANCY FONT HOME SWEET HOME,General,6.75,3336
21912,VINTAGE SNAKES & LADDERS,General,3.75,1882
21832,CHOCOLATE CALCULATOR,General,1.65,1048
22379,RECYCLING BAG RETROSPOT,General,2.1,7000
22381,TOY TIDY PINK POLKADOT,General,1.85,3491
22798,ANTIQUE GLASS DRESSING TABLE POT,General,2.95,1891
22926,IVORY GIANT GARDEN THERMOMETER,General,5.95,685
22839,3 TIER CAKE TIN GREEN AND CREAM,General,14.95,545
22838,3 TIER CAKE TIN RED AND CREAM,General,14.95,787
22783,SET 3 WICKER OVAL BASKETS W LIDS,General,16.95,559
82484,WOOD BLACK BOARD ANT WHITE FINISH,General,6.45,6117
84755,COLOUR GLASS T-LIGHT HOLDER HANGING,General,0.65,16501
22464,HANGING METAL HEART LANTERN,General,1.65,3511
21324,HANGING MEDINA LANTERN SMALL,General,2.95,175
22457,NATURAL SLATE HEART CHALKBOARD,General,2.95,9260
22469,HEART OF WICKER SMALL,General,1.45,18031
22470,HEART OF WICKER LARGE,General,2.55,9961
22224,WHITE LOVEBIRD LANTERN,General,2.95,929
21340,CLASSIC METAL BIRDCAGE PLANT HOLDER,General,12.75,1076
22189,CREAM HEART CARD HOLDER,General,3.95,8387
22427,ENAMEL FLOWER JUG CREAM,General,5.95,2207
22428,ENAMEL FIRE BUCKET CREAM,General,6.95,340
22424,ENAMEL BREAD BIN CREAM,General,10.95,967
22663,JUMBO BAG DOLLY GIRL DESIGN,General,1.95,3510
85049A,TRADITIONAL CHRISTMAS RIBBONS,General,1.25,3093
22168,ORGANISER WOOD ANTIQUE WHITE,General,8.5,241
22662,LUNCH BAG DOLLY GIRL DESIGN,General,1.65,6814
84880,WHITE WIRE EGG HOLDER,General,4.95,378
85099B,JUMBO BAG RED RETROSPOT,General,1.65,48474
79321,CHILLI LIGHTS,General,3.82,10306
22780,LIGHT GARLAND BUTTERFILES PINK,General,3.37,1346
22779,WOODEN OWLS LIGHT GARLAND,General,3.37,1540
22466,FAIRY TALE COTTAGE NIGHTLIGHT,General,1.45,3070
21363,HOME SMALL WOOD LETTERS,General,4.95,342
21411,GINGHAM HEART  DOORSTOP RED,General,4.25,890
22318,FIVE HEART HANGING DECORATION,General,2.95,556
22915,ASSORTED BOTTLE TOP  MAGNETS,General,0.42,3240
22922,FRIDGE MAGNETS US DINER ASSORTED,General,0.85,1675
22969,HOMEMADE JAM SCENTED CANDLES,General,1.45,12620
22923,FRIDGE MAGNETS LES ENFANTS ASSORTED,General,0.85,1460
21115,ROSE CARAVAN DOORSTOP,General,6.75,662
22242,5 HOOK HANGER MAGIC TOADSTOOL,General,1.65,728
22941,CHRISTMAS LIGHTS 10 REINDEER,General,8.5,1766
21622,VINTAGE UNION JACK CUSHION COVER,General,4.95,478
35004C,SET OF 3 COLOURED  FLYING DUCKS,General,5.45,488
35004G,SET OF 3 GOLD FLYING DUCKS,General,6.35,223
85014B,RED RETROSPOT UMBRELLA,General,5.95,2009
85014A,BLACK/BLUE POLKADOT UMBRELLA,General,5.95,1261
22193,RED DINER WALL CLOCK,General,8.5,1501
22192,BLUE DINER WALL CLOCK,General,8.5,1052
22191,IVORY DINER WALL CLOCK,General,8.5,1550
22195,LARGE HEART MEASURING SPOONS,General,1.65,2055
22196,SMALL HEART MEASURING SPOONS,General,0.85,2929
22962,JAM JAR WITH PINK LID,General,0.72,3956
22963,JAM JAR WITH GREEN LID,General,0.72,3343
22968,ROSE COTTAGE KEEPSAKE BOX,General,8.5,887
84970S,HANGING HEART ZINC T-LIGHT HOLDER,General,0.64,8905
22910,PAPER CHAIN KIT VINTAGE CHRISTMAS,General,2.55,10664
20668,DISCO BALL CHRISTMAS DECORATION,General,0.1,12979
22197,SMALL POPCORN HOLDER,General,0.72,56921
22198,LARGE POPCORN HOLDER,General,1.45,1075
21080,SET/20 RED RETROSPOT PAPER NAPKINS,General,0.64,13214
21086,SET/6 RED SPOTTY PAPER CUPS,General,0.65,7189
21786,POLKADOT RAIN HAT,General,0.32,1940
22654,DELUXE SEWING KIT,General,4.95,1472
21485,RETROSPOT HEART HOT WATER BOTTLE,General,4.25,3609
84030E,ENGLISH ROSE HOT WATER BOTTLE,General,3.75,1582
22174,PHOTO CUBE,General,1.48,3291
22150,3 STRIPEY MICE FELTCRAFT,General,1.95,3124
22619,SET OF 6 SOLDIER SKITTLES,General,3.75,2583
21891,TRADITIONAL WOODEN SKIPPING ROPE,General,1.25,8233
21889,WOODEN BOX OF DOMINOES,General,1.25,6490
22827,RUSTIC  SEVENTEEN DRAWER SIDEBOARD,General,165.0,134
22127,PARTY CONES CARNIVAL ASSORTED,General,1.25,492
22128,PARTY CONES CANDY ASSORTED,General,1.25,1850
22502,PICNIC BASKET WICKER SMALL,General,5.95,2036
22338,STAR DECORATION PAINTED ZINC,General,0.65,4759
22180,RETROSPOT LAMP,General,9.95,426
21506,"FANCY FONT BIRTHDAY CARD,",General,0.42,5034
22866,HAND WARMER SCOTTY DOG DESIGN,General,1.85,6636
22865,HAND WARMER OWL DESIGN,General,1.85,8502
22349,DOG BOWL CHASING BALL DESIGN,General,3.75,1456
22558,CLOTHES PEGS RETROSPOT PACK 24,General,1.25,8741
85152,HAND OVER THE CHOCOLATE   SIGN,General,2.1,8360
22652,TRAVEL SEWING KIT,General,1.65,5176
22188,BLACK HEART CARD HOLDER,General,3.95,4963
21484,CHICK GREY HOT WATER BOTTLE,General,3.45,1973
21314,SMALL GLASS HEART TRINKET POT,General,2.1,4344
22730,ALARM CLOCK BAKELIKE IVORY,General,3.75,2988
22729,ALARM CLOCK BAKELIKE ORANGE,General,3.75,2418
22867,HAND WARMER BIRD DESIGN,General,2.1,6493
22803,IVORY EMBROIDERED QUILT,General,35.75,152
35004B,SET OF 3 BLACK FLYING DUCKS,General,4.65,665
21980,PACK OF 12 RED RETROSPOT TISSUES,General,0.29,6763
21844,RED RETROSPOT MUG,General,2.95,1942
22468,BABUSHKA LIGHTS STRING OF 10,General,6.75,613
48185,DOORMAT FAIRY CAKE,General,7.95,3715
21232,STRAWBERRY CERAMIC TRINKET BOX,General,1.25,11942
22064,PINK DOUGHNUT TRINKET POT,General,1.65,1822
22449,SILK PURSE BABUSHKA PINK,General,3.35,586
22835,HOT WATER BOTTLE I AM SO POORLY,General,4.65,3566
22112,CHOCOLATE HOT WATER BOTTLE,General,4.95,6116
21479,WHITE SKULL HOT WATER BOTTLE,General,3.75,4014
22111,SCOTTIE DOG HOT WATER BOTTLE,General,4.95,4757
22110,BIRD HOUSE HOT WATER BOTTLE,General,2.55,1272
22098,BOUDOIR SQUARE TISSUE BOX,General,1.25,2093
22100,SKULLS SQUARE TISSUE BOX,General,1.25,855
22766,PHOTO FRAME CORNICE,General,2.95,3396
22451,SILK PURSE BABUSHKA RED,General,3.35,322
22549,PICTURE DOMINOES,General,1.45,3288
84744,S/6 SEW ON CROCHET FLOWERS,General,1.25,209
85049E,SCANDINAVIAN REDS RIBBONS,General,1.25,2964
21328,BALLOONS  WRITING SET,General,1.65,1441
17091A,LAVENDER INCENSE IN TIN,General,1.25,271
22473,TV DINNER TRAY VINTAGE PAISLEY,General,4.95,602
84509A,SET OF 4 ENGLISH ROSE PLACEMATS,General,3.75,994
84510A,SET OF 4 ENGLISH ROSE COASTERS,General,1.25,1299
22767,TRIPLE PHOTO FRAME CORNICE,General,9.95,872
22768,FAMILY PHOTO FRAME CORNICE,General,9.95,967
21463,MIRRORED DISCO BALL,General,5.95,750
21464,DISCO BALL ROTATOR BATTERY OPERATED,General,4.25,348
20820,SILVER LOOKING MIRROR,General,4.95,102
85150,LADIES & GENTLEMEN METAL SIGN,General,2.55,4138
22117,METAL SIGN HER DINNER IS SERVED,General,2.95,1419
48129,DOORMAT TOPIARY,General,7.95,1003
82580,BATHROOM METAL SIGN,General,0.55,5982
82578,KITCHEN METAL SIGN,General,0.55,2159
82581,TOILET METAL SIGN,General,0.55,3981
22413,METAL SIGN TAKE IT OR LEAVE IT,General,2.95,3873
21907,I'M ON HOLIDAY METAL SIGN,General,2.1,2471
22441,GROW YOUR OWN BASIL IN ENAMEL MUG,General,2.1,1150
21122,SET/10 PINK POLKADOT PARTY CANDLES,General,1.25,5430
22851,SET 20 NAPKINS FAIRY CAKES DESIGN,General,0.85,2848
22810,SET OF 6 T-LIGHTS SNOWMEN,General,2.95,1051
22809,SET OF 6 T-LIGHTS SANTA,General,2.95,1353
22435,SET OF 9 HEART SHAPED BALLOONS,General,1.25,2864
20966,SANDWICH BATH SPONGE,General,1.25,816
20963,APPLE BATH SPONGE,General,1.25,1437
20961,STRAWBERRY BATH SPONGE,General,1.25,1334
22068,BLACK PIRATE TREASURE CHEST,General,1.65,629
21743,STAR PORTABLE TABLE LIGHT,General,2.95,398
21744,SNOWFLAKE PORTABLE TABLE LIGHT,General,2.95,629
84709B,PINK OVAL JEWELLED MIRROR,General,5.95,119
21592,RETROSPOT CIGAR BOX MATCHES,General,1.25,2261
21587,COSY HOUR GIANT TUBE MATCHES,General,2.55,295
20992,JAZZ HEARTS PURSE NOTEBOOK,General,0.85,4542
22804,CANDLEHOLDER PINK HANGING HEART,General,2.95,3239
20749,ASSORTED COLOUR MINI CASES,General,7.95,1869
22382,LUNCH BAG SPACEBOY DESIGN,General,1.65,10562
20726,LUNCH BAG WOODLAND,General,1.65,10032
22384,LUNCH BAG PINK POLKADOT,General,1.65,10614
22467,GUMBALL COAT RACK,General,2.55,8057
84625C,BLUE NEW BAROQUE CANDLESTICK CANDLE,General,2.95,546
84625A,PINK NEW BAROQUECANDLESTICK CANDLE,General,2.95,575
21108,FAIRY CAKE FLANNEL ASSORTED COLOUR,General,2.55,10344
22848,BREAD BIN DINER STYLE PINK,General,16.95,423
47570B,TEA TIME TABLE CLOTH,General,10.65,284
22837,HOT WATER BOTTLE BABUSHKA,General,4.25,1238
22297,HEART IVORY TRELLIS SMALL,General,1.25,4247
22772,PINK DRAWER KNOB ACRYLIC EDWARDIAN,General,1.25,3957
22773,GREEN DRAWER KNOB ACRYLIC EDWARDIAN,General,1.25,2175
22805,BLUE DRAWER KNOB ACRYLIC EDWARDIAN,General,1.25,1992
21125,SET 6 FOOTBALL CELEBRATION CANDLES,General,1.25,748
21126,SET OF 6 GIRLS CELEBRATION CANDLES,General,1.25,681
85049C,ROMANTIC PINKS RIBBONS,General,1.25,1305
85049D,BRIGHT BLUES RIBBONS,General,1.25,637
85049G,CHOCOLATE BOX RIBBONS,General,1.25,1703
21061,PARTY INVITES FOOTBALL,General,0.85,576
21063,PARTY INVITES JAZZ HEARTS,General,0.85,616
21062,PARTY INVITES SPACEMAN,General,0.85,627
84380,SET OF 3 BUTTERFLY COOKIE CUTTERS,General,1.25,5893
84378,SET OF 3 HEART COOKIE CUTTERS,General,1.25,6438
22964,3 PIECE SPACEBOY COOKIE CUTTER SET,General,2.1,2716
21213,PACK OF 72 SKULL CAKE CASES,General,0.55,15252
22417,PACK OF 60 SPACEBOY CAKE CASES,General,0.55,8502
84992,72 SWEETHEART FAIRY CAKE CASES,General,0.55,13436
22383,LUNCH BAG SUKI  DESIGN,General,1.65,12642
20728,LUNCH BAG CARS BLUE,General,1.65,11907
20727,LUNCH BAG  BLACK SKULL.,General,1.65,12330
22296,HEART IVORY TRELLIS LARGE,General,1.65,3232
20914,SET/5 RED RETROSPOT LID GLASS BOWLS,General,2.55,6372
22537,MAGIC DRAWING SLATE DINOSAUR,General,0.42,2007
22533,MAGIC DRAWING SLATE BAKE A CAKE,General,0.42,1863
20982,12 PENCILS TALL TUBE SKULLS,General,0.85,2244
21915,RED  HARMONICA IN BOX,General,1.25,22021
21914,BLUE HARMONICA IN BOX,General,1.25,7967
21544,SKULLS  WATER TRANSFER TATTOOS,General,0.85,2063
22813,PACK 3 BOXES BIRD PANNETONE,General,1.95,2460
84375,SET OF 20 KIDS COOKIE CUTTERS,General,2.1,4409
22418,10 COLOUR SPACEBOY PEN,General,0.85,6640
22178,VICTORIAN GLASS HANGING T-LIGHT,General,1.25,24392
84970L,SINGLE HEART ZINC T-LIGHT HOLDER,General,0.95,6153
22465,HANGING METAL STAR LANTERN,General,1.65,2148
84949,SILVER HANGING T-LIGHT HOLDER,General,1.65,4895
20685,DOORMAT RED RETROSPOT,General,7.95,4190
48194,DOORMAT HEARTS,General,7.95,3517
22488,NATURAL SLATE RECTANGLE CHALKBOARD,General,1.65,3284
22219,LOVEBIRD HANGING DECORATION WHITE,General,0.85,4226
22610,PENS ASSORTED FUNNY FACE,General,0.85,9672
22716,CARD CIRCUS PARADE,General,0.42,3301
22706,WRAP COWBOYS,General,0.42,2132
22371,AIRLINE BAG VINTAGE TOKYO 78,General,4.25,1187
21210,SET OF 72 RETROSPOT PAPER  DOILIES,General,1.45,5900
22553,PLASTERS IN TIN SKULLS,General,1.65,4357
16237,SLEEPING CAT ERASERS,General,0.21,5064
22714,CARD BIRTHDAY COWBOY,General,0.42,3575
22812,PACK 3 BOXES CHRISTMAS PANNETONE,General,1.95,1814
84347,ROTATING SILVER ANGELS T-LIGHT HLDR,General,2.55,9570
22736,RIBBON REEL MAKING SNOWMEN,General,1.65,1323
22620,4 TRADITIONAL SPINNING TOPS,General,1.25,4982
21705,BAG 500g SWIRLY MARBLES,General,1.65,1547
90199C,5 STRAND GLASS NECKLACE CRYSTAL,General,6.35,117
22785,SQUARECUSHION COVER PINK UNION FLAG,General,6.75,344
22975,SPACEBOY CHILDRENS EGG CUP,General,1.25,1303
22972,CHILDREN'S SPACEBOY MUG,General,1.65,1897
22568,FELTCRAFT CUSHION OWL,General,3.75,3479
85116,BLACK CANDELABRA T-LIGHT HOLDER,General,2.1,1040
22664,TOY TIDY DOLLY GIRL DESIGN,General,2.1,812
21609,SET 12 LAVENDER  BOTANICAL T-LIGHTS,General,2.95,863
21866,UNION JACK FLAG LUGGAGE TAG,General,1.25,849
20669,RED HEART LUGGAGE TAG,General,1.25,403
90129F,RED GLASS TASSLE BAG CHARM,General,2.95,139
90210B,CLEAR ACRYLIC FACETED BANGLE,General,2.95,140
21955,DOORMAT UNION JACK GUNS AND ROSES,General,7.95,1329
72802C,VANILLA SCENT CANDLE JEWELLED BOX,General,4.25,1495
22109,FULL ENGLISH BREAKFAST PLATE,General,3.75,1741
22531,MAGIC DRAWING SLATE CIRCUS PARADE,General,0.42,3483
21811,CHRISTMAS HANGING HEART WITH BELL,General,1.25,4953
22183,CAKE STAND VICTORIAN FILIGREE MED,General,6.75,421
21678,PAISLEY PATTERN  STICKERS,General,0.85,219
21676,FLOWERS  STICKERS,General,0.85,351
85169B,BLACK LOVE BIRD CANDLE,General,1.25,417
16238,PARTY TIME PENCIL ERASERS,General,0.21,1470
84906,PINK B'FLY C/COVER W BOBBLES,General,5.95,134
21867,PINK UNION JACK  LUGGAGE TAG,General,1.25,452
22075,6 RIBBONS ELEGANT CHRISTMAS,General,1.65,1899
21326,AGED GLASS SILVER T-LIGHT HOLDER,General,0.65,10671
21065,BOOM BOX SPEAKER GIRLS,General,5.95,663
22074,6 RIBBONS SHIMMERING PINKS,General,1.65,1502
20713,JUMBO BAG OWLS,General,1.95,11543
21116,OWL DOORSTOP,General,4.95,794
21824,PAINTED METAL STAR WITH HOLLY BELLS,General,1.45,2014
21823,PAINTED METAL HEART WITH HOLLY BELL,General,1.45,1470
22153,ANGEL DECORATION STARS ON DRESS,General,0.42,2747
85099F,JUMBO BAG STRAWBERRY,General,1.95,17372
20717,STRAWBERRY SHOPPER BAG,General,1.25,2956
22328,ROUND SNACK BOXES SET OF 4 FRUITS,General,2.95,6946
22327,ROUND SNACK BOXES SET OF 4 SKULLS,General,2.95,1277
22630,DOLLY GIRL LUNCH BOX,General,1.95,11892
21245,GREEN POLKADOT PLATE,General,1.69,1177
21244,BLUE POLKADOT PLATE,General,1.69,2381
21242,RED RETROSPOT PLATE,General,1.69,3475
21243,PINK  POLKADOT PLATE,General,1.69,2384
22273,FELTCRAFT DOLL MOLLY,General,2.95,4613
22940,FELTCRAFT CHRISTMAS FAIRY,General,4.25,2027
22759,SET OF 3 NOTEBOOKS IN PARCEL,General,1.65,5544
21880,RED RETROSPOT TAPE,General,0.65,1993
21738,COSY SLIPPER SHOES SMALL  RED,General,2.95,147
22077,6 RIBBONS RUSTIC CHARM,General,1.65,9282
21448,12 DAISY PEGS IN WOOD BOX,General,1.65,447
22243,5 HOOK HANGER RED MAGIC TOADSTOOL,General,1.65,3193
22141,CHRISTMAS CRAFT TREE TOP ANGEL,General,2.1,2895
22144,CHRISTMAS CRAFT LITTLE FRIENDS,General,2.1,4180
21739,COSY SLIPPER SHOES SMALL GREEN,General,2.95,354
22271,FELTCRAFT DOLL ROSIE,General,2.95,1804
22274,FELTCRAFT DOLL EMILY,General,2.95,1445
22751,FELTCRAFT PRINCESS OLIVIA DOLL,General,3.75,1664
21034,REX CASH+CARRY JUMBO SHOPPER,General,0.95,2038
22570,FELTCRAFT CUSHION RABBIT,General,3.75,3189
22569,FELTCRAFT CUSHION BUTTERFLY,General,3.75,2863
22902,TOTE BAG I LOVE LONDON,General,2.1,1389
21710,FOLDING UMBRELLA PINKWHITE POLKADOT,General,4.95,206
21708,FOLDING UMBRELLA CREAM POLKADOT,General,4.95,290
21711,FOLDING UMBRELLA WHITE/RED POLKADOT,General,4.95,203
22179,SET 10 LIGHTS NIGHT OWL,General,6.75,1065
21706,FOLDING UMBRELLA RED/WHITE POLKADOT,General,4.95,446
85184C,S/4 VALENTINE DECOUPAGE HEART BOX,General,2.95,1755
22988,SOLDIERS EGG CUP,General,1.25,9231
20750,RED RETROSPOT MINI CASES,General,7.95,1847
22952,60 CAKE CASES VINTAGE CHRISTMAS,General,0.55,16169
22739,RIBBON REEL CHRISTMAS SOCK BAUBLE,General,1.65,1932
22738,RIBBON REEL SNOWY VILLAGE,General,1.65,2286
22909,SET OF 20 VINTAGE CHRISTMAS NAPKINS,General,0.85,9082
35591T,TURQUOISE CHRISTMAS TREE,General,1.25,103
22186,RED STAR CARD HOLDER,General,2.95,943
22695,WICKER WREATH SMALL,General,1.45,838
22580,ADVENT CALENDAR GINGHAM SACK,General,5.95,1412
22147,FELTCRAFT BUTTERFLY HEARTS,General,1.45,6326
22130,PARTY CONE CHRISTMAS DECORATION,General,0.85,2371
22694,WICKER STAR,General,2.1,1941
21790,VINTAGE SNAP CARDS,General,0.85,14625
22149,FELTCRAFT 6 FLOWER FRIENDS,General,2.1,6174
22321,BIRD DECORATION RED RETROSPOT,General,0.85,1005
22594,CHRISTMAS GINGHAM TREE,General,0.85,2101
22593,CHRISTMAS GINGHAM STAR,General,0.85,2361
22595,CHRISTMAS GINGHAM HEART,General,0.85,6895
21986,PACK OF 12 PINK POLKADOT TISSUES,General,0.29,4155
22750,FELTCRAFT PRINCESS LOLA DOLL,General,3.75,2118
22616,PACK OF 12 LONDON TISSUES,General,0.29,26223
22775,PURPLE DRAWERKNOB ACRYLIC EDWARDIAN,General,1.25,3326
22899,CHILDREN'S APRON DOLLY GIRL,General,2.1,2168
22367,CHILDRENS APRON SPACEBOY DESIGN,General,1.95,3852
22942,CHRISTMAS LIGHTS 10 SANTAS,General,8.5,706
21976,PACK OF 60 MUSHROOM CAKE CASES,General,0.55,5328
22951,60 CAKE CASES DOLLY GIRL DESIGN,General,0.55,7616
22834,HAND WARMER BABUSHKA DESIGN,General,2.1,5067
21916,SET 12 RETRO WHITE CHALK STICKS,General,0.42,4698
22587,FELTCRAFT HAIRBAND RED AND BLUE,General,0.85,1017
22566,FELTCRAFT HAIRBAND PINK AND PURPLE,General,0.85,976
22565,FELTCRAFT HAIRBANDS PINK AND WHITE,General,0.85,1031
22472,TV DINNER TRAY DOLLY GIRL,General,4.95,420
22557,PLASTERS IN TIN VINTAGE PAISLEY,General,1.65,4818
22551,PLASTERS IN TIN SPACEBOY,General,1.65,8179
22554,PLASTERS IN TIN WOODLAND ANIMALS,General,1.65,7910
22534,MAGIC DRAWING SLATE SPACEBOY,General,0.42,4593
22529,MAGIC DRAWING SLATE GO TO THE FAIR,General,0.42,950
22530,MAGIC DRAWING SLATE DOLLY GIRL,General,0.42,3728
84032B,CHARLIE + LOLA RED HOT WATER BOTTLE,General,2.95,1036
85049H,URBAN BLACK RIBBONS,General,1.25,947
22807,SET OF 6 T-LIGHTS TOADSTOOLS,General,2.95,913
21494,ROTATING LEAVES T-LIGHT HOLDER,General,1.25,2022
22938,CUPCAKE LACE PAPER SET 6,General,1.95,2455
21892,TRADITIONAL WOODEN CATCH CUP GAME,General,1.25,3284
21890,S/6 WOODEN SKITTLES IN COTTON BAG,General,2.95,1246
21718,RED METAL BEACH SPADE,General,1.25,1582
21716,BOYS VINTAGE TIN SEASIDE BUCKET,General,2.55,1533
21715,GIRLS VINTAGE TIN SEASIDE BUCKET,General,2.55,1422
22113,GREY HEART HOT WATER BOTTLE,General,3.75,3327
22358,KINGS CHOICE TEA CADDY,General,2.95,794
22357,KINGS CHOICE BISCUIT TIN,General,4.25,564
22115,METAL SIGN EMPIRE TEA,General,2.95,1643
21481,FAWN BLUE HOT WATER BOTTLE,General,2.95,3407
22585,PACK OF 6 BIRDY GIFT TAGS,General,1.25,6320
21556,CERAMIC STRAWBERRY MONEY BOX,General,2.55,1071
22645,CERAMIC HEART FAIRY CAKE MONEY BANK,General,1.45,2451
22650,CERAMIC PIRATE CHEST MONEY BANK,General,1.45,948
22508,DOORSTOP RETROSPOT HEART,General,3.75,1691
22511,RETROSPOT BABUSHKA DOORSTOP,General,3.75,347
22829,SWEETHEART WIRE WALL TIDY,General,9.95,327
21154,RED RETROSPOT OVEN GLOVE,General,1.06,4035
17021,NAMASTE SWAGAT INCENSE,General,0.24,2427
22059,CERAMIC STRAWBERRY DESIGN MUG,General,1.25,1842
84678,CLASSICAL ROSE SMALL VASE,General,1.25,194
85172,HYACINTH BULB T-LIGHT CANDLES,General,0.42,1414
22142,CHRISTMAS CRAFT WHITE FAIRY,General,1.45,3348
21591,COSY HOUR CIGAR BOX MATCHES,General,1.25,1472
22480,RED TEA TOWEL CLASSIC DESIGN,General,1.25,719
22294,HEART FILIGREE DOVE  SMALL,General,1.25,5586
21156,RETROSPOT CHILDRENS APRON,General,1.95,3270
10133,COLOURING PENCILS BROWN TUBE,General,0.85,2962
72800E,4 IVORY DINNER CANDLES SILVER FLOCK,General,2.55,635
84836,ZINC METAL HEART DECORATION,General,1.25,6032
20774,GREEN FERN NOTEBOOK,General,1.65,184
20773,BLUE PAISLEY NOTEBOOK,General,1.65,154
20777,CHRYSANTHEMUM NOTEBOOK,General,1.65,267
16016,LARGE CHINESE STYLE SCISSOR,General,0.85,1363
16014,SMALL CHINESE STYLE SCISSOR,General,0.42,13418
21651,HANGING GLASS ETCHED TEALIGHT,General,1.65,227
22618,COOKING SET RETROSPOT,General,9.95,167
21586,KINGS CHOICE GIANT TUBE MATCHES,General,2.55,839
22152,PLACE SETTING WHITE STAR,General,0.42,2484
84754,S/15 SILVER GLASS BAUBLES IN BAG,General,1.25,634
22670,FRENCH WC SIGN BLUE METAL,General,1.25,1971
84849B,FAIRY SOAP SOAP HOLDER,General,1.69,354
22927,GREEN GIANT GARDEN THERMOMETER,General,5.95,528
22925,BLUE GIANT GARDEN THERMOMETER,General,5.95,548
21259,VICTORIAN SEWING BOX SMALL,General,5.95,1282
21257,VICTORIAN SEWING BOX MEDIUM,General,7.95,787
21121,SET/10 RED POLKADOT PARTY CANDLES,General,1.25,6710
82552,WASHROOM METAL SIGN,General,1.45,3104
90200B,BLACK SWEETHEART BRACELET,General,4.25,191
90059B,DIAMANTE HAIR GRIP PACK/2 BLACK DIA,General,1.65,114
90185C,BLACK DIAMANTE EXPANDABLE RING,General,4.25,124
90059E,DIAMANTE HAIR GRIP PACK/2 RUBY,General,1.65,122
90059C,DIAMANTE HAIR GRIP PACK/2 MONTANA,General,1.65,114
90200C,BLUE SWEETHEART BRACELET,General,4.25,149
90200D,PINK SWEETHEART BRACELET,General,4.25,273
90200A,PURPLE SWEETHEART BRACELET,General,4.25,177
22737,RIBBON REEL CHRISTMAS PRESENT,General,1.65,1488
21260,FIRST AID TIN,General,3.25,1260
22744,MAKE YOUR OWN MONSOON CARD KIT,General,2.95,968
21985,PACK OF 12 HEARTS DESIGN TISSUES,General,0.29,8902
22295,HEART FILIGREE DOVE LARGE,General,1.65,2906
16258A,SWIRLY CIRCULAR RUBBERS IN BAG,General,0.42,571
21992,VINTAGE PAISLEY STATIONERY SET,General,2.95,2012
21124,SET/10 BLUE POLKADOT PARTY CANDLES,General,1.25,4114
22735,RIBBON REEL SOCKS AND MITTENS,General,1.65,844
22945,CHRISTMAS METAL TAGS ASSORTED,General,0.85,3097
21816,CHRISTMAS TREE T-LIGHT HOLDER,General,1.45,132
21815,STAR  T-LIGHT HOLDER,General,1.45,255
21814,HEART T-LIGHT HOLDER,General,1.45,176
10125,MINI FUNKY DESIGN TAPES,General,0.85,1394
22573,STAR WOODEN CHRISTMAS DECORATION,General,0.85,2788
