product_id,product_name,category,price,stock_qty
21397,BLUE POLKADOT EGG CUP,General,3.36,1174
21627,ELEPHANT CARNIVAL POUFFE,General,29.79,162
21632,VINTAGE PINK DECORATIVE PARASOL,General,25.49,187
22106,MIRROR MOSAIC HURRICANE LAMP,General,5.06,448
22108,PING! MICROWAVE PLATE,General,3.36,251
22221,CAKE STAND LOVEBIRD 2 TIER PINK,General,20.38,230
22223,CAKE PLATE LOVEBIRD PINK,General,10.17,540
22282,12 EGG HOUSE PAINTED WOOD,General,25.49,247
22329,ROUND CONTAINER SET OF 5 RETROSPOT,General,3.36,1702
22416,SET OF 36 DOILIES SPACEBOY DESIGN,General,2.98,967
22613,PACK OF 20 SPACEBOY NAPKINS,General,1.66,1637
35648,VINTAGE BEAD PINK PURSE,General,5.91,1080
35651,VINTAGE BEAD PINK SCARF,General,16.13,550
37447,CERAMIC CAKE DESIGN SPOTTED PLATE,General,3.36,918
46118,FUNKY MONKEY CUSHION COVER,General,8.47,331
46776C,WOVEN FROST CUSHION COVER,General,4.21,216
46776E,WOVEN CANDY CUSHION COVER,General,4.21,166
62094B,TURQ ICE CREAM BUM BAG,General,5.06,118
84078A,SET/4 WHITE RETRO STORAGE CUBES,General,76.55,514
84228,HEN HOUSE W CHICK STANDING,General,0.84,396
84568,GIRLS ALPHABET IRON ON PATCHES,General,0.43,13945
84789,ENCHANTED BIRD PLANT CAGE,General,7.62,286
84813,SET OF 4 DIAMOND NAPKIN RINGS,General,25.49,265
85093,CANDY SPOT EGG WARMER HARE,General,2.51,807
85096,HILDA CANDY SPOT RABBIT,General,7.62,124
85202,HANGING WOOD AND FELT HEART,General,0.84,775
85204,HANGING WOOD AND FELT FLOWER,General,0.84,2154
90001D,ANTIQUE OLIVE GREEN FLOWER EARRINGS,General,4.24,106
90013C,GREEN VINTAGE EARRINGS,General,4.24,138
90014B,GOLD M PEARL  ORBIT NECKLACE,General,10.62,116
90085,CRYSTAL STILETTO PHONE CHARM,General,1.66,133
90132,LIGHT TOPAZ TEAL/AQUA COL NECKLACE,General,5.09,102
90140,PINK SWEETIE NECKLACE,General,7.64,101
90141B,IVORY PENDANT TRIPLE SHELL NECKLACE,General,5.09,108
90158,ST TROPEZ NECKLACE,General,5.09,144
90183A,AMBER DROP EARRINGS W LONG BEADS,General,2.96,139
90183B,AMETHYST DROP EARRINGS W LONG BEADS,General,2.96,120
90201B,BLACK ENAMEL FLOWER RING,General,2.96,185
90212B,JET BLACK LAS VEGAS BRACELET ROUND,General,3.81,109
84712B,PINK JEWELLED PHOTO FRAME,General,7.95,127
22279,POCKET BAG BLUE PAISLEY RED SPOT,General,1.25,931
22280,POCKET BAG PINK PAISELY BROWN SPOT,General,1.25,566
22377,BOTTLE BAG RETROSPOT,General,4.21,1429
22495,SET OF 2 ROUND TINS CAMEMBERT,General,5.91,382
22521,CHILDS GARDEN TROWEL PINK,General,1.66,717
22523,CHILDS GARDEN FORK PINK,General,1.66,964
22677,FRENCH BLUE METAL DOOR SIGN 2,General,2.51,1100
22682,FRENCH BLUE METAL DOOR SIGN 7,General,2.51,776
22715,CARD WEDDING DAY,General,0.85,1642
21253,SET OF PICTURE FRAME  STICKERS,General,5.91,234
21265,PINK GOOSE FEATHER TREE 60CM,General,5.91,230
21389,IVORY HANGING DECORATION  BIRD,General,1.66,1215
21391,FRENCH LAVENDER SCENT HEART,General,4.21,1178
21403,BLUE EGG  SPOON,General,0.85,1955
21534,DAIRY MAID LARGE MILK JUG,General,10.17,475
21618,4 WILDFLOWER BOTANICAL CANDLES,General,7.62,505
21812,GARLAND WITH HEARTS AND BELLS,General,10.17,493
21847,GREEN  DIAMANTE PEN IN GIFT BOX,General,4.21,175
21943,CAKES AND RABBITS DESIGN FLANNEL,General,1.66,218
22104,MIRROR MOSAIC CANDLE PLATE,General,1.66,387
22322,BIRD DECORATION GREEN POLKADOT,General,1.66,919
22340,NOEL GARLAND PAINTED ZINC,General,3.36,1510
35833G,4 GOLD FLOCK CHRISTMAS BALLS,General,3.36,100
35916A,YELLOW FELT HANGING HEART W FLOWER,General,1.66,182
46776A,WOVEN BUBBLE GUM CUSHION COVER,General,4.21,253
72351B,SET/6 PINK  BUTTERFLY T-LIGHTS,General,4.21,2197
84459A,PINK METAL CHICKEN HEART,General,3.36,816
84637,KITCHEN FLOWER POTS WALL PLAQUE,General,12.72,215
85039B,S/4 IVORY MINI ROSE CANDLE IN BOWL,General,1.66,905
85039C,S/4 BLACK MINI ROSE CANDLE IN BOWL,General,1.66,404
85131C,BEADED CRYSTAL HEART BLUE ON STICK,General,0.85,286
90010E,AMBER GLASS/SILVER BRACELET,General,9.34,121
90039C,FIRE POLISHED GLASS BRACELET BLACK,General,3.81,105
90056,CHUNKY CRACKED GLAZE NECKLACE IVORY,General,11.05,103
90081C,LILY BROOCH OLIVE COLOUR,General,5.09,119
90101,WHITE FRANGIPANI NECKLACE,General,2.54,138
90130B,TURQ STONE/CRYSTAL EARRINGS,General,2.96,138
90130C,GREEN STONE/CRYSTAL EARRINGS,General,2.96,113
15044C,PURPLE PAPER PARASOL,General,5.91,412
20762,GREEN FERN SKETCHBOOK,General,7.62,205
20803,SMALL PINK GLASS SUNDAE DISH,General,3.36,1041
18007,ESSENTIAL BALM 3.5g TIN IN ENVELOPE,General,0.18,5960
21720,CAKE SHOP  STICKER SHEET,General,0.85,145
84968F,SET OF 16 VINTAGE SKY BLUE CUTLERY,General,12.75,276
21289,LARGE STRIPES CHOCOLATE GIFT BAG,General,1.25,651
22606,WOODEN SKITTLES GARDEN SET,General,15.95,414
37479B,CUBIC MUG FLOCK BLUE ON BROWN,General,2.55,230
37482P,CUBIC MUG PINK POLKADOT,General,2.55,605
20903,VINTAGE KEEPSAKE BOX TRAVELOGUE,General,6.35,180
20897,VINTAGE NOTEBOOK PARIS DAYS,General,2.95,201
71403,"PINK/WHITE ""KEEP CLEAN"" BULLET BIN",General,2.95,176
22683,FRENCH BLUE METAL DOOR SIGN 8,General,1.25,742
22685,FRENCH BLUE METAL DOOR SIGN 0,General,1.25,692
21973,SET OF 36 MUSHROOM PAPER DOILIES,General,1.45,253
22691,DOORMAT WELCOME SUNRISE,General,7.95,471
21162,TOXIC AREA  DOOR HANGER,General,1.45,1564
84926D,LA PALMIERA TILE COASTER,General,1.25,808
22233,JIGSAW RABBIT AND BIRDHOUSE,General,1.65,695
22486,PLASMATRONIC LAMP,General,12.75,169
72801G,4 BURGUNDY WINE DINNER CANDLES,General,1.25,155
84711A,SILVER OVAL SHAPE TRINKET BOX,General,9.95,123
16169N,WRAP BLUE RUSSIAN FOLKART,General,0.42,100
20769,DAISY JOURNAL,General,2.55,177
35597A,DUSTY PINK CHRISTMAS TREE 30CM,General,1.25,100
47480,HANGING PHOTO CLIP ROPE LADDER,General,1.65,847
84522,PINK PARTY SUNGLASSES,General,1.95,119
20731,POSY CANDY BAG,General,1.25,191
35597B,BLACKCHRISTMAS TREE 30CM,General,1.25,100
84596B,SMALL DOLLY MIX DESIGN ORANGE BOWL,General,1.25,5177
21226,POCKET MIRROR WOODLAND,General,1.25,193
79160,HEART SHAPE WIRELESS DOORBELL,General,2.1,546
72131,COLUMBIAN CANDLE RECTANGLE,General,1.95,236
21089,SET/6 GREEN SPRING PAPER CUPS,General,0.65,331
21647,ASSORTED TUTTI FRUTTI LARGE PURSE,General,2.1,217
72122,COFFEE SCENT PILLAR CANDLE,General,0.95,424
84912A,PINK ROSE WASHBAG,General,3.75,255
85036A,GARDENIA 1 WICK MORRIS BOXED CANDLE,General,4.25,322
21692,SILVER LATTICE VANILLA CANDLE POT,General,3.75,116
84569A,PACK 3 IRON ON DOG PATCHES,General,1.25,382
20775,DAISY NOTEBOOK,General,1.65,234
90179C,BLACK FINE BEAD NECKLACE W TASSEL,General,5.95,105
90060D,FIRE POLISHED GLASS NECKL BRONZE,General,5.95,102
85020,ROUND PINK HEART MIRROR,General,2.1,177
20861,GOLD COSMETIC BAG PINK STAR,General,2.1,101
21827,EIGHT PIECE CREEPY CRAWLIE SET,General,1.25,105
79051A,SMOKEY GREY COLOUR D.O.F. GLASS,General,0.65,927
17007B,S/3 POT POURI CUSHIONS BLUE COLOURS,General,2.1,112
22700,BLACK AND WHITE DOG BOWL,General,2.95,1292
10124A,SPOTS ON RED BOOKCOVER TAPE,General,0.42,112
21644,ASSORTED TUTTI FRUTTI HEART BOX,General,1.25,313
46000P,POLYESTER FILLER PAD 65CMx65CM,General,4.25,116
22681,FRENCH BLUE METAL DOOR SIGN 6,General,1.25,809
21746,SMALL RED RETROSPOT WINDMILL,General,1.25,3174
84916,HAND TOWEL PALE BLUE W FLOWERS,General,5.95,322
40005B,BLUE ORGANDY ROUND LAMPSHADE W BEA,General,0.85,111
18094C,WHITE AND BLUE CERAMIC OIL BURNER,General,1.25,291
22085,PAPER CHAIN KIT SKULLS,General,2.95,647
47586A,PINK FAIRY CAKE CUSHION COVER,General,2.55,119
46115B,GREEN POP ART MAO CUSHION COVER,General,0.19,106
84975,HEART SHAPED MIRROR,General,1.69,102
21336,GOLD WASHBAG,General,2.95,126
22050,PINK PAISLEY ROSE GIFT WRAP,General,0.42,1300
21680,WOODLAND  STICKERS,General,0.85,962
20819,SILVER TEDDY BEAR,General,3.75,163
84925F,PSYCHEDELIC WALL THERMOMETER,General,2.55,179
22535,MAGIC DRAWING SLATE BUNNIES,General,0.42,1864
16169K,WRAP FOLK ART,General,0.42,275
21001,ROSE DU SUD WASHBAG,General,4.21,171
21028,NINJA RABBIT BLACK,General,2.51,286
21171,BATHROOM METAL SIGN,General,3.36,537
21204,DAISIES  HONEYCOMB GARLAND,General,3.36,598
21222,SET/4 BADGES BEETLES,General,2.51,368
21251,DINOSAUR HEIGHT CHART STICKER SET,General,5.91,281
21375,LARGE CAMPHOR WOOD FIELD MUSHROOM,General,11.02,141
21595,Dad's Cab Electronic Meter,General,8.47,101
22101,MIRROR MOSAIC VOTIVE HOLDER,General,2.51,1528
35914,PINK CHICK EGG WARMER + EGG CUP,General,4.21,294
37462E,"PET MUG, GOLDFISH",General,0.84,134
37474,SET/4 2 TONE EGG SHAPE MIXING BOWLS,General,9.95,100
47481,50CM METAL STRING WITH  7 CLIPS,General,2.13,325
84313B,BLUE TV TRAY TABLE,General,16.98,226
84422,PINK/BLUE DISC/MIRROR STRING,General,1.66,665
84429A,MEDIUM PINK BUDDHA HEAD,General,5.91,153
84509C,SET OF 4 POLKADOT PLACEMATS,General,7.62,230
84510C,SET OF 4 POLKADOT COASTERS,General,2.51,233
84840,SWEETHEART CARRY-ALL BASKET,General,16.98,105
84917,WHITE HAND TOWEL WITH BUTTERFLY,General,4.21,283
85087,CANDY SPOT CUSHION COVER,General,8.47,438
85094,CANDY SPOT EGG WARMER RABBIT,General,2.51,740
85125,SMALL ROUND CUT GLASS CANDLESTICK,General,10.17,261
90013A,MIDNIGHT BLUE VINTAGE EARRINGS,General,3.81,151
90059A,DIAMANTE HAIR GRIP PACK/2 CRYSTAL,General,1.69,144
90073,VINTAGE ENAMEL & CRYSTAL EARRINGS,General,5.09,126
90074,BLACK DIAMOND CLUSTER NECKLACE,General,9.77,103
90104,PURPLE FRANGIPANI HAIRCLIP,General,0.83,126
90129C,GREEN GLASS TASSLE BAG CHARM,General,1.66,132
90129D,AMBER GLASS TASSLE BAG CHARM,General,1.66,113
90129E,PURPLE GLASS TASSLE BAG CHARM,General,1.66,138
90160C,TURQ+RED BOUDICCA LARGE BRACELET,General,7.22,153
90161D,ANT COPPER PINK BOUDICCA BRACELET,General,5.09,162
90175B,PINK GLASS CHUNKY CHARM BRACELET,General,9.34,109
90177D,DROP DIAMANTE EARRINGS PURPLE,General,2.96,124
90184C,BLACK CHUNKY BEAD BRACELET W STRAP,General,9.34,120
90185A,AMBER DIAMANTE EXPANDABLE RING,General,4.24,130
90208,PAIR OF PINK FLOWER CLUSTER SLIDE,General,2.54,152
15044D,RED PAPER PARASOL,General,5.91,744
84707A,SILVER JEWELLED MIRROR TRINKET TRAY,General,9.95,191
21617,4 LILY  BOTANICAL DINNER CANDLES,General,3.75,616
22693,GROW A FLYTRAP OR SUNFLOWER IN TIN,General,1.25,16320
35646,VINTAGE BEAD PINK EVENING BAG,General,4.25,715
47574A,ENGLISH ROSE SCENTED HANGING FLOWER,General,4.25,646
71279,PINK GLASS CANDLEHOLDER,General,2.95,270
72819,CUPID DESIGN SCENTED CANDLES,General,2.55,319
84665,SQUARE CHERRY BLOSSOM CABINET,General,5.95,201
20857,BLUE ROSE PATCH PURSE PINK BUTTERFL,General,1.65,126
22498,WOODEN REGATTA BUNTING,General,5.95,433
84725,FREESTYLE CANVAS ART PICTURE,General,4.25,140
37479P,CUBIC MUG FLOCK PINK ON BROWN,General,2.55,273
17038,PORCELAIN BUDAH INCENSE HOLDER,General,0.07,1525
84388,WISE MAN STAR SHAPE EGG PAN,General,1.65,123
17084J,LOVE POTION MASALA INCENSE,General,0.21,300
84968D,SET OF 16 VINTAGE RED CUTLERY,General,12.75,256
22211,WOOD STAMP SET FLOWERS,General,1.65,1108
22903,CALENDAR FAMILY FAVOURITES,General,2.95,292
22026,BANQUET BIRTHDAY  CARD,General,0.42,1744
37340,MULTICOLOUR SPRING FLOWER MUG,General,0.85,2640
AMAZONFEE,AMAZON FEE,General,13541.33,101
16052,TEATIME PUSH DOWN RUBBER,General,0.84,577
16219,HOUSE SHAPE PENCIL SHARPENER,General,1.7,3147
20763,DAISY SKETCHBOOK,General,7.62,172
20801,LARGE PINK GLASS SUNDAE DISH,General,5.06,1111
20892,SET/3 TALL GLASS CANDLE HOLDER PINK,General,25.49,102
21316,SMALL CHUNKY GLASS ROMAN  BOWL,General,5.91,259
21666,RIDGED GLASS T-LIGHT HOLDER,General,1.66,511
22293,HANGING CHICK GREEN DECORATION,General,2.98,1006
22608,PENS ASSORTED FUNKY JEWELED,General,1.66,5346
22789,T-LIGHT HOLDER SWEETHEART HANGING,General,4.21,958
22880,NUMBER TILE VINTAGE FONT 1,General,4.21,198
22883,NUMBER TILE VINTAGE FONT 4,General,4.21,199
22889,NUMBER TILE VINTAGE FONT No,General,4.21,272
35809A,ENAMEL PINK TEA CONTAINER,General,4.21,520
35833P,4 PINK FLOCK CHRISTMAS BALLS,General,3.36,149
37500,TEA TIME TEAPOT IN GIFT BOX,General,21.23,479
37501,TEA TIME TEA SET IN GIFT BOX,General,14.43,231
79144C,PAINTED LIGHTBULB RAINBOW DESIGN,General,0.84,251
85130B,BEADED CRYSTAL HEART GREEN LARGE,General,3.36,933
85170C,SET/6 EAU DE NIL BIRD T-LIGHTS,General,4.21,433
90000B,MIDNIGHT BLUE COPPER FLOWER NECKLAC,General,6.37,110
90003B,ROSE COLOUR PAIR HEART HAIR SLIDES,General,3.81,114
90005A,JADE GREEN ENAMEL HAIR COMB,General,2.11,113
90019C,SILVER BLACK ORBIT BRACELET,General,5.51,112
90087,CRYSTAL SEA HORSE PHONE CHARM,General,1.66,206
90168,2 DAISIES HAIR COMB,General,2.96,117
90169,DAISY HAIR COMB,General,2.54,118
90187B,GREEN DROP EARRINGS W BEAD CLUSTER,General,3.39,111
90202C,GREEN ENAMEL FLOWER HAIR TIE,General,2.96,119
90210C,RED   ACRYLIC FACETED BANGLE,General,2.96,198
22528,GARDENERS KNEELING PAD,General,3.36,100
48189,DOORMAT FRIENDSHIP,General,16.98,126
84989a,75 GREEN FAIRY CAKE CASES,General,2.13,141
15056n,EDWARDIAN PARASOL NATURAL,General,12.72,225
21410,COUNTRY COTTAGE  DOORSTOP GREEN,General,8.47,100
22516,CHILDS GARDEN RAKE BLUE,General,4.21,306
84559b,3D SHEET OF CAT STICKERS,General,1.69,122
84660c,PINK STITCHED WALL CLOCK,General,7.62,117
85114c,RED ENCHANTED FOREST PLACEMAT,General,3.36,259
85173,SET/6 FROG PRINCE T-LIGHT CANDLES,General,5.06,578
22513,DOORSTOP FOOTBALL DESIGN,General,7.62,252
72351a,SET/6 TURQUOISE BUTTERFLY T-LIGHTS,General,4.21,113
84510c,SET OF 4 POLKADOT COASTERS,General,2.51,139
84596b,SMALL DOLLY MIX DESIGN ORANGE BOWL,General,2.51,106
85035c,ROSE 3 WICK MORRIS BOX CANDLE,General,8.47,100
85119,WATERING CAN SINGLE HOOK PISTACHIO,General,3.36,100
85132a,CHARLIE + LOLA BISCUITS TINS,General,21.23,107
22679,FRENCH BLUE METAL DOOR SIGN 4,General,2.51,840
22875,NUMBER TILE COTTAGE GARDEN 7,General,4.21,162
47570b,TEA TIME TABLE CLOTH,General,21.23,101
84558a,3D DOG PICTURE PLAYING CARDS,General,5.91,104
21689,SILVER VANILLA  FLOWER CANDLE POT,General,3.75,194
84247E,PACK/12 XMAS FUN CARD,General,2.95,242
85170B,SET/6 BLACK BIRD T-LIGHT CANDLES,General,2.1,314
85170A,SET/6 IVORY BIRD T-LIGHT CANDLES,General,2.1,100
85059,FRENCH ENAMEL WATER BASIN,General,3.75,510
84497,BUTTONS AND STRIPES NOTEBOOK,General,3.75,112
85026B,EAU DE NILE JEWELLED T-LIGHT HOLDER,General,0.85,169
90175D,TIGRIS EYE CHUNKY CHARM BRACELET,General,8.95,121
22512,DOORSTOP RACING CAR DESIGN,General,7.62,222
22611,VINTAGE UNION JACK SHOPPING BAG,General,10.17,324
22873,NUMBER TILE COTTAGE GARDEN 5,General,4.21,159
37467,PIG MUG IN TWO COLOUR DESIGNS,General,4.21,258
84251B,"GREETING CARD, STICKY GORDON",General,0.85,344
84927D,LA PALMIERA TILE HOOK,General,4.21,147
85040A,S/4 PINK FLOWER CANDLES IN BOWL,General,3.36,988
85213,MINI  ZINC GARDEN DECORATIONS,General,1.66,940
90001C,ANTIQUE OPAL WHITE FLOWER EARRINGS,General,4.24,104
90019A,SILVER M.O.P ORBIT BRACELET,General,5.51,136
90023,FILIGREE DIAMANTE EARRINGS,General,4.24,112
90027A,GLASS BEAD HOOP EARRINGS BLACK,General,2.96,105
90170,DAISY HAIR BAND,General,1.69,184
90186B,CRYSTAL HOOP EARRING FLORAL LEAF,General,2.96,121
90198A,VINTAGE ROSE BEAD BRACELET RASPBERR,General,4.24,174
90211B,JET BLACK LAS VEGAS NECKLACE 45CM,General,5.94,107
90214K,"LETTER ""K"" BLING KEY RING",General,0.85,177
90214P,"LETTER ""P"" BLING KEY RING",General,0.85,138
90214Z,"LETTER ""Z"" BLING KEY RING",General,0.85,121
20663,QUEEN OF THE SKIES HOLIDAY PURSE,General,2.51,124
20794,BLUE  TILE HOOK,General,5.06,198
21269,ANTIQUE CREAM CUTLERY SHELF,General,16.98,128
21792,CLASSIC FRENCH STYLE BASKET GREEN,General,13.57,443
90212C,PURPLE LAS VEGAS BRACELET ROUND,General,3.75,104
22708,WRAP DOLLY GIRL,General,0.42,2875
22048,BIRTHDAY BANQUET GIFT WRAP,General,0.42,1050
22057,CERAMIC PLATE STRAWBERRY DESIGN,General,1.49,680
22930,BAKING MOULD HEART MILK CHOCOLATE,General,2.55,1208
22931,BAKING MOULD HEART WHITE CHOCOLATE,General,2.55,914
22932,BAKING MOULD TOFFEE CUP CHOCOLATE,General,2.55,983
22937,BAKING MOULD CHOCOLATE CUPCAKES,General,2.55,1072
22710,WRAP I LOVE LONDON,General,0.42,4576
22051,BLUE SCANDINAVIAN PAISLEY WRAP,General,0.42,1075
22936,BAKING MOULD ROSE WHITE CHOCOLATE,General,3.25,376
22935,BAKING MOULD ROSE MILK CHOCOLATE,General,3.25,787
47348A,FUSCHIA VOILE POINTY SHOE DEC,General,1.95,196
21686,MEDINA STAMPED METAL STOOL,General,39.95,134
85024C,PINK SMALL JEWELLED PHOTOFRAME,General,1.65,111
71038,WHITE HANGING BEADS CANDLE HOLDER,General,5.45,337
84613C,BLUE NEW BAROQUE FLOCK CANDLESTICK,General,4.65,100
84910A,PINK PAISLEY CUSHION COVER,General,5.95,124
21246,RED RETROSPOT BIG BOWL,General,4.95,384
21376,LARGE  TALL CAMPHOR WOOD TOADSTOOL,General,5.45,136
20618,QUEEN OF THE SKIES PASSPORT COVER,General,2.1,247
47420,ASSORTED COLOUR SUCTION CUP HOOK,General,0.19,300
22510,GINGHAM BABUSHKA DOORSTOP,General,3.75,307
48116,DOORMAT MULTICOLOUR STRIPE,General,7.95,1590
72709,IVORY SCULPTED RND CANDLE,General,0.85,135
72132,COLUMBIAN CUBE CANDLE,General,1.95,122
85118,HEART T-LIGHT HOLDER,General,1.25,235
35968,FOLK ART METAL HEART T-LIGHT HOLDER,General,0.38,251
22063,CERAMIC BOWL WITH STRAWBERRY DESIGN,General,2.95,678
90184B,AMETHYST CHUNKY BEAD BRACELET W STR,General,8.95,128
90184A,AMBER CHUNKY BEAD BRACELET W STRAP,General,8.95,108
84415B,BLUE FLOCK CUSHION COVER,General,3.75,106
20906,VINTAGE NOTEBOOK BEAUTY GIRL,General,2.95,102
21275,ZINC TOP  2 DOOR WOODEN SHELF,General,16.95,112
71495B,CD WALL TIDY RED FLOWERS,General,0.42,251
78124,MAGAZINE RACK GEBRA ASSORTED,General,2.75,293
79403,FROSTED WHITE BASE,General,1.66,194
84251G,"GREETING CARD, OVERCROWDED POOL.",General,0.85,369
90034,WHITE SILVER NECKLACE SHELL GLASS,General,10.19,101
90040C,MURANO STYLE GLASS BRACELET GOLD,General,3.81,114
90059D,DIAMANTE HAIR GRIP PACK/2 PERIDOT,General,1.69,124
90089,PINK CRYSTAL SKULL PHONE CHARM,General,1.66,131
90120A,PINK MURANO TWIST BRACELET,General,4.24,106
90201D,GREEN ENAMEL FLOWER RING,General,2.96,176
17013D,ORIGAMI ROSE INCENSE IN TUBE,General,3.36,634
17096,ASSORTED LAQUERED INCENSE HOLDERS,General,0.43,2644
21285,RETROSPOT CANDLE  MEDIUM,General,4.21,462
21442,GREEN BIRDHOUSE DECORATION,General,1.66,539
21717,EASTER TIN BUCKET,General,5.06,507
21749,LARGE RED RETROSPOT WINDMILL,General,4.21,2061
21750,LARGE SKULL WINDMILL,General,4.21,188
22538,MINI JIGSAW GO TO THE FAIR,General,0.85,501
22541,MINI JIGSAW LEAP FROG,General,0.85,603
22647,CERAMIC LOVE HEART MONEY BANK,General,3.36,831
22145,CHRISTMAS CRAFT HEART STOCKING,General,2.1,100
85230G,ORANGE VOTIVE CANDLE,General,0.29,1108
71215,METAL BASE FOR CANDLES,General,0.42,110
20695,FLORAL BLUE MONSTER,General,4.25,104
22820,GIFT BAG BIRTHDAY,General,0.65,1028
84952A,CLEAR LOVE BIRD T-LIGHT HOLDER,General,3.75,174
84706D,CHERRY BLOSSOM TABLE CLOCK,General,8.95,106
22828,REGENCY MIRROR WITH SHUTTERS,General,165.0,109
22591,CARDHOLDER GINGHAM CHRISTMAS TREE,General,2.55,509
22703,PINK CAT BOWL,General,2.1,459
84247L,FAWN AND MUSHROOM GREETING CARD,General,0.42,216
22698,PINK REGENCY TEACUP AND SAUCER,General,2.95,5923
84875B,GREEN SQUARE COMPACT MIRROR,General,3.75,227
84876D,BLUE HEART COMPACT MIRROR,General,3.75,225
84192,ASSORTED COLOUR METAL CAT,General,1.25,203
21628,TRIANGULAR POUFFE VINTAGE,General,14.95,162
22254,FELT TOADSTOOL LARGE,General,1.25,745
21615,4 LAVENDER BOTANICAL DINNER CANDLES,General,3.75,986
22236,CAKE STAND 3 TIER MAGIC GARDEN,General,10.95,396
22933,BAKING MOULD EASTER EGG MILK CHOC,General,2.95,1028
22689,DOORMAT MERRY CHRISTMAS RED,General,7.95,771
85107,CUT GLASS T-LIGHT HOLDER OCTAGON,General,2.55,339
21382,SET/4 SPRING FLOWER DECORATION,General,2.95,1245
44235,ASS COL CIRCLE MOBILE,General,0.42,634
40003,WHITE BAMBOO RIBS LAMPSHADE,General,1.25,254
79190B,RETRO PLASTIC POLKA TRAY,General,0.42,792
90036D,"FLOWER GLASS GARLAND NECKL.36""BLACK",General,7.95,111
21120,*Boombox Ipod Classic,General,16.98,100
21264,WHITE GOOSE FEATHER TREE 60CM,General,5.91,384
21284,RETROSPOT CANDLE  SMALL,General,3.36,503
22201,FRYING PAN BLUE POLKADOT,General,8.47,292
22269,EGG CUP NATURAL CHICKEN,General,2.51,1032
22526,WHEELBARROW FOR CHILDREN,General,25.49,224
84012,MAGIC SHEEP WOOL GROWING FROM PAPER,General,5.06,1364
85180B,PINK HEARTS LIGHT CHAIN,General,9.32,370
90030B,RED KUKUI COCONUT SEED NECKLACE,General,5.94,221
90030C,BROWN KUKUI COCONUT SEED NECKLACE,General,5.94,176
90039B,FIRE POLISHED GLASS BRACELET MONTAN,General,3.81,110
90039D,FIRE POLISHED GLASS BRACELET GREEN,General,3.81,120
90093,CLEAR CRYSTAL STAR PHONE CHARM,General,1.66,151
90128A,PINK LEAVES AND BEADS PHONE CHARM,General,2.51,102
90128C,GREEN LEAVES AND BEADS PHONE CHARM,General,2.51,101
90128D,PURPLE LEAVES AND BEADS PHONE CHAR,General,2.51,101
90161C,ANT COPPER LIME BOUDICCA BRACELET,General,5.09,182
90174,BUTTERFLY HAIR BAND,General,2.54,137
90188,DROP EARRINGS W FLOWER & LEAF,General,2.54,109
90214O,"LETTER ""O"" BLING KEY RING",General,0.85,115
DCGS0076,SUNJAR LED NIGHT NIGHT LIGHT,General,16.13,102
16015,MEDIUM CHINESE STYLE SCISSOR,General,0.5,761
16008,SMALL FOLDING SCISSOR(POINTED EDGE),General,0.25,2990
37444B,BLUE BREAKFAST CUP AND SAUCER,General,2.95,102
37333,"RETRO ""TEA FOR ONE""",General,4.95,120
20778,GARDEN PATH NOTEBOOK,General,1.65,112
20758,ABSTRACT CIRCLES POCKET BOOK,General,0.85,255
21535,RED RETROSPOT SMALL MILK JUG,General,2.55,2595
22319,HAIRCLIPS FORTIES FABRIC ASSORTED,General,0.65,1434
22824,3 TIER SWEETHEART GARDEN SHELF,General,35.95,154
21132,SILVER STANDING GNOME,General,4.25,140
84818,DANISH ROSE PHOTO FRAME,General,2.55,1523
90033,IVORY SHELL HEART EARRINGS,General,2.55,109
84843,WHITE SOAP RACK WITH 2 BOTTLES,General,5.95,270
85032A,ROMANTIC IMAGES GIFT WRAP SET,General,2.1,884
85032C,CURIOUS IMAGES GIFT WRAP SET,General,2.1,779
35809a,ENAMEL PINK TEA CONTAINER,General,4.21,108
79066k,RETRO MOD TRAY,General,1.66,116
84536b,FAIRY CAKES NOTEBOOK A7 SIZE,General,0.81,100
84968a,SET OF 16 VINTAGE ROSE CUTLERY,General,25.49,104
21144,PINK POODLE HANGING DECORATION,General,3.36,103
21317,GLASS SPHERE CANDLE STAND MEDIUM,General,11.02,211
72815,3 WICK CHRISTMAS BRIAR CANDLE,General,8.47,102
84510a,SET OF 4 ENGLISH ROSE COASTERS,General,2.51,152
84968e,SET OF 16 VINTAGE BLACK CUTLERY,General,25.49,107
85035a,GARDENIA 3 WICK MORRIS BOXED CANDLE,General,8.47,101
22885,NUMBER TILE VINTAGE FONT 6,General,4.21,195
84660b,BLACK STITCHED WALL CLOCK,General,7.62,101
84356,POMPOM CURTAIN,General,6.95,523
47578A,ENGLISH ROSE SMALL SCENTED FLOWER,General,0.85,311
21562,HAWAIIAN GRASS SKIRT,General,1.25,412
22856,ASSORTED EASTER DECORATIONS  BELLS,General,1.25,651
22934,BAKING MOULD EASTER EGG WHITE CHOC,General,2.95,677
16048,TEATIME ROUND PENCIL SHARPENER,General,0.85,1560
20932,PINK POT PLANT CANDLE,General,7.62,303
22263,FELT EGG COSY LADYBIRD,General,1.66,426
46776F,WOVEN ROSE GARDEN CUSHION COVER,General,4.21,309
84509E,SET OF 4 CAROUSEL PLACEMATS,General,7.62,190
84510E,SET OF 4 GREEN CAROUSEL COASTERS,General,2.51,133
84748,FOLK FELT HANGING MULTICOL GARLAND,General,7.62,307
90070,RUBY GLASS CLUSTER BRACELET,General,6.37,119
90147,CHUNKY SILVER NECKLACE PASTEL FLOWE,General,10.62,131
90201C,RED ENAMEL FLOWER RING,General,2.96,162
37475,SET/4 COLOURFUL MIXING BOWLS,General,9.95,167
84951A,SET OF 4 PISTACHIO LOVEBIRD COASTER,General,2.55,570
84951B,SET OF 4 BLACK LOVEBIRD COASTERS,General,2.55,545
22053,EMPIRE DESIGN ROSETTE,General,1.25,4334
21131,GOLD STANDING GNOME,General,3.75,176
20654,FIRST CLASS LUGGAGE TAG,General,1.25,249
17165D,ASS COL LARGE SAND FROG P'WEIGHT,General,1.05,121
22291,HANGING CHICK CREAM DECORATION,General,1.45,1393
15058A,BLUE POLKADOT GARDEN PARASOL,General,7.95,299
20868,SILVER FABRIC MIRROR,General,1.25,556
84820,DANISH ROSE TRINKET TRAYS,General,5.95,359
85006,SET 4 NURSERY DES ROUND BOXES,General,2.95,152
84821,DANISH ROSE DELUXE COASTER,General,0.85,1035
84638,SMALL KITCHEN FLOWER POTS PLAQUE,General,6.95,149
22229,BUNNY WOODEN PAINTED WITH FLOWER,General,0.85,667
22228,BUNNY WOODEN PAINTED WITH BIRD,General,0.85,1100
16169P,WRAP GREEN RUSSIAN FOLKART,General,0.42,125
16054,POPART RECT PENCIL SHARPENER ASST,General,0.42,1264
84595E,LARGE TORTILLA DESIGN RED BOWL,General,3.75,177
35915B,BLUE KNITTED HEN,General,1.65,318
85086A,CANDY SPOT HEART DECORATION,General,0.85,245
85084,HOLLY TOP CHRISTMAS STOCKING,General,0.85,119
81950V,FLOWER PURPLE CLOCK W/SUCKER,General,0.85,120
22055,MINI CAKE STAND  HANGING STRAWBERY,General,1.45,1413
84631,FRUIT TREE AND BIRDS WALL PLAQUE,General,7.95,139
84799,SPRIG LAVENDER ARTIFICIAL FLOWER,General,0.42,276
35004P,SET OF 3 PINK FLYING DUCKS,General,5.45,100
21454,PAINTED PINK RABBIT,General,0.85,671
15058B,PINK POLKADOT GARDEN PARASOL,General,7.95,327
22391,PAPERWEIGHT HOME SWEET HOME,General,2.55,252
21318,GLASS CHALICE BLUE SMALL,General,3.36,795
21418,STARFISH SOAP DISH,General,5.06,173
21420,OYSTER TRINKET BOX,General,6.77,153
22286,"DECORATION , WOBBLY RABBIT , METAL",General,3.36,1248
22287,"DECORATION , WOBBLY CHICKEN, METAL",General,3.36,895
35609A,PINK FEATHER CHRISTMAS DECORATION,General,2.51,100
35610C,WHITE CHRISTMAS FLOCK DROPLET,General,2.51,124
46776D,WOVEN SUNSET CUSHION COVER,General,4.21,188
84688,BEACH HUT DESIGN BLACKBOARD,General,8.47,140
84931A,PINK SCOTTIE DOG W FLOWER PATTERN,General,5.06,234
84968E,SET OF 16 VINTAGE BLACK CUTLERY,General,25.49,231
85211,S/4 GROOVY CAT MAGNETS,General,3.36,248
90031,BILI NUT AND WOOD NECKLACE,General,5.94,149
90040A,MURANO STYLE GLASS BRACELET RED,General,4.24,113
90125B,AQUA BERTIE GLASS BEAD BAG CHARM,General,4.21,129
90125D,PURPLE BERTIE GLASS BEAD BAG CHARM,General,4.21,194
DCGS0003,BOXED GLASS ASHTRAY,General,2.51,103
85230E,STRAWBRY SCENTED VOTIVE CANDLE,General,0.29,1177
22826,LOVE SEAT ANTIQUE WHITE METAL,General,175.0,156
22852,DOG BOWL VINTAGE CREAM,General,4.25,482
22102,MIRROR MOSAIC T-LIGHT HOLDER,General,1.65,1716
16033,MINI HIGHLIGHTER PENS,General,0.12,840
20830,SILVER PHOTO FRAME,General,2.1,230
20831,GOLD PHOTO FRAME,General,2.1,310
90003D,CRYSTAL PAIR HEART HAIR SLIDES,General,3.75,129
90067A,PINK VINTAGE VICTORIAN EARRINGS,General,2.95,113
21378,SMALL TALL CAMPHOR WOOD TOADSTOOL,General,1.65,236
85032B,BLOSSOM IMAGES GIFT WRAP SET,General,2.1,850
22857,ASSORTED EASTER GIFT TAGS,General,0.85,1211
22858,EASTER TIN KEEPSAKE,General,1.65,1187
22861,EASTER TIN CHICKS IN GARDEN,General,1.65,375
22230,JIGSAW TREE WITH WATERING CAN,General,0.85,1124
22232,JIGSAW TOADSTOOLS 3 PIECE,General,1.65,758
20793,BLUE TILED TRAY,General,6.75,107
20664,TROPICAL HOLIDAY PURSE,General,2.95,130
