product_id,product_name,category,price,stock_qty
47593A,CAROUSEL PONIES BABY BIB,General,1.25,131
20670,VIP HOLIDAY PURSE,General,2.95,113
21946,PARTY TIME DESIGN FLANNEL,General,0.85,184
20666,ECONOMY HOLIDAY PURSE,General,2.95,129
82605,OLD DOC RUSSEL METAL SIGN,General,2.1,110
85136B,BLUE SHARK HELICOPTER,General,7.95,101
84882,GREEN WIRE STANDING CANDLE HOLDER,General,3.75,135
85031A,ROMANTIC IMAGES SCRAP BOOK SET,General,4.95,114
16216,LETTER SHAPE PENCIL SHARPENER,General,0.16,3423
84660B,BLACK STITCHED WALL CLOCK,General,1.25,789
21248,DOOR HANGER  MUM + DADS ROOM,General,1.45,304
21736,GOLD SCROLL GLASS T-LIGHT HOLDER,General,2.1,144
84922,PINK BUTTERFLY WASHBAG,General,4.25,107
90036E,"FLOWER GLASS GARLD NECKL36""AMETHYST",General,7.95,113
90160A,PURPLE BOUDICCA LARGE BRACELET,General,6.95,135
90160B,RED BOUDICCA LARGE BRACELET,General,6.95,128
90160D,PINK BOUDICCA LARGE BRACELET,General,6.95,136
82011A,"BATHROOM SCALES, TROPICAL BEACH",General,3.75,116
85183A,CHARLIE & LOLA WASTEPAPER BIN BLUE,General,3.75,761
21194,PINK  HONEYCOMB PAPER FAN,General,4.21,597
21972,SET OF 36 DINOSAUR PAPER DOILIES,General,2.98,434
22281,EASTER TREE YELLOW BIRDS,General,12.72,231
22887,NUMBER TILE VINTAGE FONT 8,General,4.21,177
84876B,GREEN HEART COMPACT MIRROR,General,7.62,319
90126A,PINK BERTIE MOBILE PHONE CHARM,General,3.36,100
90190B,GOLD/AMBER DROP EARRINGS W LEAF,General,2.96,112
35610B,BLACK CHRISTMAS FLOCK DROPLET,General,1.25,100
84927E,FLOWERS TILE HOOK,General,2.1,153
84816,DANISH ROSE BEDSIDE CABINET,General,39.95,112
90120D,WHITE MURANO TWIST BRACELET,General,4.25,109
22289,HANGING METAL CHICKEN DECORATION,General,2.51,251
20704,MR ROBOT SOFT TOY,General,14.43,315
20818,GOLD TEDDY BEAR,General,7.62,114
21199,PINK  HEART CONFETTI IN TUBE,General,3.36,1065
21293,MIRRORED DOVE WALL DECORATION,General,4.21,212
71495A,CD WALL TIDY BLUE OFFICE,General,0.84,202
84584,PINK GINGHAM CAT WITH SCARF,General,5.06,243
85179C,PINK BITTY LIGHT CHAIN,General,9.32,205
85188B,PINK METAL SWINGING BUNNY,General,1.66,176
90076,MONTANA DIAMOND CLUSTER EARRINGS,General,2.96,108
90164A,PINK ROSEBUD PEARL BRACELET,General,7.64,126
90164B,WHITE  ROSEBUD PEARL BRACELET,General,7.64,137
72780,BLACK SILOUETTE CANDLE PLATE,General,0.85,225
22954,HEN PARTY CORDON BARRIER TAPE,General,1.25,290
22047,EMPIRE GIFT WRAP,General,0.42,3500
22214,CANDLE PLATE LACE WHITE,General,2.55,289
90162C,ANT SILVER FUSCHIA BOUDICCA RING,General,2.95,112
90078,PINK/WHITE GLASS DEMI CHOKER,General,7.5,100
90032,IVORY SHELL HEART NECKLACE,General,6.25,117
21331,MOROCCAN BEATEN METAL DISH LARGE,General,12.75,110
20848,ZINC HEART LATTICE CHARGER SMALL,General,2.95,117
20826,SILVER APERITIF GLASS,General,2.12,370
21145,ANTIQUE GLASS PLACE SETTING,General,1.25,198
22723,SET OF 6 HERB TINS SKETCHBOOK,General,3.95,1265
22722,SET OF 6 SPICE TINS PANTRY DESIGN,General,3.95,6074
22720,SET OF 3 CAKE TINS PANTRY DESIGN,General,4.95,7587
84575A,PINK DOG CANNISTER,General,5.95,113
84313C,ORANGE TV TRAY TABLE,General,4.25,603
21473,SWEETHEART CREAM STEEL TABLE RECT,General,19.95,126
90210A,GREY ACRYLIC FACETED BANGLE,General,1.25,122
84823,DANISH ROSE FOLDING CHAIR,General,7.95,200
90057,DIAMANTE RING ASSORTED IN BOX.,General,1.25,1060
90210D,PURPLE ACRYLIC FACETED BANGLE,General,1.25,195
22656,VINTAGE BLUE KITCHEN CABINET,General,125.0,124
22782,SET 3 WICKER STORAGE BASKETS,General,9.95,333
84766,SILVER ROCOCO CANDLE STICK,General,1.95,234
20860,GOLD COSMETICS BAG WITH BUTTERFLY,General,2.1,100
84711B,PINK OVAL SHAPE TRINKET BOX,General,9.95,119
84817,DANISH ROSE DECORATIVE PLATE,General,0.42,1027
22721,SET OF 3 CAKE TINS SKETCHBOOK,General,4.95,1121
22711,WRAP CIRCUS PARADE,General,0.42,3002
22522,CHILDS GARDEN FORK BLUE,General,0.85,1031
22520,CHILDS GARDEN TROWEL BLUE,General,0.85,818
22270,HAPPY EASTER HANGING DECORATION,General,3.75,331
85195,HANGING HEART BASKET,General,2.1,103
85194L,HANGING SPRING FLOWER EGG LARGE,General,0.85,1012
84660A,WHITE STITCHED WALL CLOCK,General,1.25,883
75178,ASSTD COL BUTTERFLY/CRYSTAL W/CHIME,General,0.42,459
75011,BLUE DAISY MOBILE,General,0.85,248
47503A,ASS FLORAL PRINT MULTI SCREWDRIVER,General,0.42,2834
22888,NUMBER TILE VINTAGE FONT 9,General,0.42,152
22886,NUMBER TILE VINTAGE FONT 7,General,0.42,163
22881,NUMBER TILE VINTAGE FONT 2,General,0.42,178
22879,NUMBER TILE VINTAGE FONT 0,General,0.42,146
21631,HIPPY CHIC DECORATIVE PARASOL,General,3.95,257
20705,MRS ROBOT SOFT TOY,General,1.95,227
90125A,PINK BERTIE GLASS BEAD BAG CHARM,General,0.85,203
85180A,RED HEARTS LIGHT CHAIN,General,1.25,579
85159B,"WHITE TEA,COFFEE,SUGAR JARS",General,1.25,710
22204,MILK PAN BLUE POLKADOT,General,3.75,296
90058B,CRYSTAL STUD EARRINGS ASSORTED COL,General,0.38,676
84597B,RETRO BROWN BALL ASHTRAY,General,1.25,139
84616,SILVER ROCCOCO CHANDELIER,General,29.95,113
84666,SQUARE CHERRY BLOSSOM CABINET,General,3.95,118
22303,COFFEE MUG APPLES DESIGN,General,5.06,2918
84796a,PINK HAWAIIAN PICNIC HAMPER FOR 2,General,8.47,116
20871,OPULENT VELVET SET/3 CANDLES,General,4.21,100
21160,KEEP OUT GIRLS DOOR HANGER,General,3.36,100
21186,WHITE DOVE HONEYCOMB PAPER GARLAND,General,3.36,100
72801d,4 SKY BLUE DINNER CANDLES,General,2.51,174
85114a,BLACK ENCHANTED FOREST PLACEMAT,General,3.36,148
84673A,PINK FLY SWAT,General,0.65,189
21386,IVORY HANGING DECORATION  EGG,General,0.85,821
90146,FINE SILVER NECKLACE W PASTEL FLOWE,General,7.5,115
22257,FELT FARM ANIMAL SHEEP,General,0.42,373
22258,FELT FARM ANIMAL RABBIT,General,0.42,912
22259,FELT FARM ANIMAL HEN,General,0.42,481
35817P,"ACRYLIC JEWEL SNOWFLAKE,PINK",General,2.55,112
85141,JARDIN ETCHED GLASS FRUITBOWL,General,10.75,222
90042A,FRESHWATER PEARL BRACELET GOLD,General,2.55,102
90136,PALE PINK/AMETHYST STONE NECKLACE,General,9.95,102
90060B,FIRE POLISHED GLASS NECKL GOLD,General,5.95,100
90035A,"PEARL & SHELL 42""NECKL. GREEN",General,10.75,104
90133,TEAL/FUSCHIA COL BEAD NECKLACE,General,4.95,118
90179A,AMBER FINE BEAD NECKLACE W TASSEL,General,5.95,105
79329,PINK FLOCK GLASS CANDLEHOLDER,General,1.65,106
85146,JARDIN ETCHED GLASS SMALL BELL JAR,General,4.95,133
22033,BOTANICAL ROSE GREETING CARD,General,0.42,425
22032,BOTANICAL LILY GREETING CARD,General,0.42,515
84751B,BLACK MEDIUM GLASS CAKE STAND,General,3.75,117
84507B,STRIPES DESIGN MONKEY DOLL,General,2.55,136
84620,BLUE GINGHAM ROSE CUSHION COVER,General,5.95,100
84929,ASSTD FRUIT+FLOWERS FRIDGE MAGNETS,General,0.55,2488
21707,FOLDING UMBRELLA BLACKBLUE POLKADOT,General,4.95,258
22868,NUMBER TILE COTTAGE GARDEN 0,General,1.95,156
22877,NUMBER TILE COTTAGE GARDEN 9,General,1.95,157
22878,NUMBER TILE COTTAGE GARDEN No,General,2.1,165
22874,NUMBER TILE COTTAGE GARDEN 6,General,1.95,159
22872,NUMBER TILE COTTAGE GARDEN 4,General,1.95,166
22869,NUMBER TILE COTTAGE GARDEN 1,General,1.95,190
22871,NUMBER TILE COTTAGE GARDEN 3,General,1.95,161
22302,COFFEE MUG PEARS  DESIGN,General,2.55,2418
47594B,SCOTTIES DESIGN WASHBAG,General,1.95,269
21196,ROUND WHITE CONFETTI IN TUBE,General,1.65,207
22218,CAKE STAND LACE WHITE,General,4.25,100
22970,LONDON BUS COFFEE MUG,General,2.55,4464
22062,CERAMIC BOWL WITH LOVE HEART DESIGN,General,2.95,682
22040,BOTANICAL ROSE GIFT WRAP,General,0.42,800
21348,PINK SPOTS CHOCOLATE NESTING BOXES,General,2.55,216
22971,QUEENS GUARD COFFEE MUG,General,2.55,2507
84877B,GREEN ROUND COMPACT MIRROR,General,1.25,220
84926F,PSYCHEDELIC TILE COASTER,General,0.42,506
21400,RED PUDDING SPOON,General,0.42,979
35911A,MULTICOLOUR RABBIT EGG WARMER,General,2.1,418
85031C,CURIOUS IMAGES SCRAP BOOK SET,General,4.95,100
84613A,PINK NEW BAROQUE FLOCK CANDLESTICK,General,4.65,105
90012B,BLACK DROP CRYSTAL NECKLACE,General,9.95,112
21043,APRON MODERN VINTAGE COTTON,General,5.95,588
37342,POLKADOT COFFEE CUP & SAUCER PINK,General,0.85,1646
84750B,BLACK SMALL GLASS CAKE STAND,General,1.95,160
21425,SKULLS STORAGE BOX LARGE,General,2.95,186
72800C,4 PINK DINNER CANDLE SILVER FLOCK,General,2.55,231
35810A,ENAMEL PINK COFFEE CONTAINER,General,2.1,728
21491,SET OF THREE VINTAGE GIFT WRAPS,General,1.95,100
21633,SUNFLOWER DECORATIVE PARASOL,General,3.95,213
35607A,PINK FLUFFY CHRISTMAS DECORATION,General,0.19,102
22410,MONEY BOX HOUSEKEEPING DESIGN,General,1.25,325
84859A,SILVER DISCO HANDBAG,General,5.95,228
85103,SILVER T-LIGHT SETTING,General,6.75,242
85031B,BLOSSOM IMAGES SCRAP BOOK SET,General,4.95,100
22249,DECORATION WHITE CHICK MAGIC GARDEN,General,0.85,1028
22407,MONEY BOX FIRST ADE DESIGN,General,1.25,194
85205B,PINK FELT EASTER RABBIT GARLAND,General,2.55,210
22929,SCHOOL DESK AND CHAIR,General,65.0,118
85163A,WHITE BAROQUE WALL CLOCK,General,12.75,165
85163B,BLACK BAROQUE WALL CLOCK,General,12.75,183
85088,CANDY SPOT HAND BAG,General,4.21,358
90201A,PURPLE ENAMEL FLOWER RING,General,2.96,168
90202A,PURPLE ENAMEL FLOWER HAIR TIE,General,2.96,121
90206A,GOLD DIAMANTE STAR BROOCH,General,5.09,111
84600,NEW BAROQUE JEWELLERY BOX,General,16.13,152
84857C,PINK MONTE CARLO HANDBAG,General,16.98,197
90144,SILVER DROP EARRINGS WITH FLOWER,General,3.81,117
90165B,WHITE ROSEBUD  PEARL EARRINGS,General,2.54,118
20694,FLORAL PINK MONSTER,General,7.62,142
20869,GOLD FABRIC MIRROR,General,1.28,277
20954,*USB Office Mirror Ball,General,8.47,101
21455,PAINTED YELLOW WOODEN DAISY,General,1.66,711
22206,"MUG , DOTCOMGIFTSHOP.COM",General,0.85,104
35933,PINK STOCKING CHRISTMAS DECORATION,General,4.21,325
85232A,SET/3 POLKADOT STACKING TINS,General,10.17,177
90027B,GLASS BEAD HOOP EARRINGS MONTANA,General,2.96,102
90122A,PINK CRYSTAL+GLASS BRACELET,General,5.09,121
90197B,BLACK GLASS BRACELET W HEART CHARMS,General,5.09,134
72225C,LAVENDER SCENT CAKE CANDLE,General,0.29,700
21424,WOODLAND STORAGE BOX LARGE,General,2.95,440
46000U,POLYESTER FILLER PAD 30CMx30CM,General,1.25,205
35400,WOODEN BOX ADVENT CALENDAR,General,8.95,109
90072,RUBY DROP CHANDELIER EARRINGS,General,4.24,120
90214T,"LETTER ""T"" BLING KEY RING",General,0.85,123
20934,SET/3 POT PLANT CANDLES,General,11.02,167
21402,RED  EGG  SPOON,General,0.85,1468
47585A,PINK FAIRY CAKE CUSHION COVER,General,10.17,363
90011D,PURPLE CRYSTAL DROP EARRINGS,General,2.96,102
90012A,MIDNIGHT BLUE DROP CRYSTAL NECKLACE,General,10.2,110
90042C,FRESHWATER PEARL BRACELET IVORY,General,2.54,104
90141C,TURQ PENDANT TRIPLE SHELL NECKLACE,General,5.51,109
90142A,GREEN PENDANT SHELL NECKLACE,General,5.09,100
90165A,PINK ROSEBUD PEARL EARRINGS,General,2.54,115
90177B,DROP DIAMANTE EARRINGS BLACK DIAMON,General,2.96,113
90202D,PINK ENAMEL FLOWER HAIR TIE,General,2.96,121
90154,LAZER CUT NECKLACE W PASTEL BEADS,General,8.95,156
90199D,5 STRAND GLASS NECKLACE AMBER,General,6.35,105
90014A,SILVER/MOP ORBIT NECKLACE,General,9.95,126
90178B,PURPLE CHUNKY GLASS+BEAD NECKLACE,General,11.95,100
21009,ETCHED GLASS STAR TREE DECORATION,General,1.25,100
21793,CLASSIC FRENCH STYLE BASKET BROWN,General,6.75,403
85023B,EAU DE NILE JEWELLED PHOTOFRAME,General,2.55,204
85109,PINK BOUDOIR T-LIGHT HOLDER,General,0.85,100
84804A,CREAM DELPHINIUM ARTIFICIAL FLOWER,General,2.95,168
84800L,LARGE WHITE/PINK ROSE ART FLOWER,General,2.12,458
84800M,MEDIUM WHITE/PINK ROSE ART FLOWER,General,1.69,226
84802A,WHITE ANEMONE ARTIFICIAL FLOWER,General,1.69,100
84806A,PINK CANDYSTUFT ARTIFICIAL FLOWER,General,1.45,236
22707,WRAP MONSTER FUN,General,0.42,1332
21503,TOYBOX  WRAP,General,0.42,801
90108,BLUE BLOSSOM HAIR CLIP,General,1.05,167
16207A,PINK STRAWBERRY HANDBAG,General,2.95,158
21747,SMALL SKULL WINDMILL,General,1.25,584
84457,SET/3 RABBITS FLOWER SKIPPPING ROPE,General,0.85,215
84249A,"GREETING CARD,SQUARE, DOUGHNUTS",General,0.42,262
22148,EASTER CRAFT 4 CHICKS,General,4.21,2038
90011B,BLACK CRYSTAL DROP EARRINGS,General,2.96,111
90055,CRACKED GLAZE EARRINGS BROWN,General,2.54,104
90142D,MOP PENDANT SHELL NECKLACE,General,5.09,109
90176B,DIAMANTE NECKLACE BLACK,General,7.64,103
gift_0001_40,Dotcomgiftshop Gift Voucher £40.00,General,34.04,102
21198,WHITE HEART CONFETTI IN TUBE,General,0.42,1081
90027D,GLASS BEAD HOOP EARRINGS AMETHYST,General,2.95,105
44228,CANNABIS LEAF BEAD CURTAIN,General,0.85,112
85230A,OPIUM SCENTED VOTIVE CANDLE,General,0.21,892
79191D,RETRO PLASTIC DAISY TRAY,General,1.66,134
22066,LOVE HEART TRINKET POT,General,1.45,2343
35819B,"ACRYLIC HANGING JEWEL,BLUE",General,2.51,369
84199,GLOW IN DARK DOLPHINS,General,0.21,235
82613A,"METAL SIGN,CUPCAKE SINGLE HOOK",General,1.25,152
85135A,YELLOW DRAGONFLY HELICOPTER,General,7.95,118
22823,CHEST NATURAL WOOD 20 DRAWERS,General,125.0,123
DCGS0070,CAMOUFLAGE DOG COLLAR,General,12.72,100
22138,BAKING SET 9 PIECE RETROSPOT,General,4.95,5045
15044A,PINK PAPER PARASOL,General,2.95,558
85231b,CINAMMON SET OF 9 T-LIGHTS,General,1.66,102
85114b,IVORY ENCHANTED FOREST PLACEMAT,General,3.36,130
85160a,WHITE BIRD GARDEN DESIGN MUG,General,16.13,100
m,Manual,General,2.55,100
82613b,"METAL SIGN,CUPCAKE SINGLE HOOK",General,2.51,103
82613c,"METAL SIGN,CUPCAKE SINGLE HOOK",General,2.51,104
84795b,SUNSET CHECK HAMMOCK,General,16.98,114
85126,LARGE ROUND CUTGLASS CANDLESTICK,General,13.57,100
47518f,ICON PLACEMAT POP ART ELVIS,General,4.21,104
85035b,CHOCOLATE 3 WICK MORRIS BOX CANDLE,General,8.47,100
84968f,SET OF 16 VINTAGE SKY BLUE CUTLERY,General,25.49,100
85049g,CHOCOLATE BOX RIBBONS,General,2.51,211
84499,BLACK FLOWER CANDLE PLATE,General,0.85,106
16045,POPART WOODEN PENCILS ASST,General,0.12,8900
21394,RED POLKADOT BEAKER,General,1.95,3959
22046,TEA PARTY  WRAPPING PAPER,General,0.42,2325
84931B,BLUE SCOTTIE DOG W FLOWER PATTERN,General,1.66,274
21270,ANTIQUE CREAM CUTLERY CUPBOARD,General,8.47,149
85161,ACRYLIC GEOMETRIC LAMP,General,12.72,132
90011A,MIDNIGHT BLUE CRYSTAL DROP EARRINGS,General,2.96,105
90013D,PURPLE VINTAGE EARRINGS,General,4.24,103
90024E,NEW BAROQUE B'FLY NECKLACE MONTANA,General,8.49,101
90024F,NEW BAROQUE B'FLY NECKLACE CRYSTAL,General,8.49,104
90103,PURPLE FRANGIPANI NECKLACE,General,2.54,128
90152A,SILVER/NAT SHELL NECKLACE W PENDANT,General,5.51,104
90205C,LARGE CRYSTAL DIAMANTE HAIRSLIDE,General,1.69,128
22247,BUNNY DECORATION MAGIC GARDEN,General,0.81,759
gift_0001_50,Dotcomgiftshop Gift Voucher £50.00,General,42.55,103
84251C,"GREETING CARD, TWO SISTERS.",General,0.43,214
16206B,RED PURSE WITH PINK HEART,General,1.25,105
46138B,BLUE CHENILLE SHAGGY CUSHION COVER,General,1.95,141
20701,PINK CAT FLORAL CUSHION COVER,General,3.75,124
90112,PINK DOLLY HAIR CLIPS,General,1.05,100
35443,RASTA IN BATH W SPLIFF ASHTRAY,General,0.85,107
21661,VINTAGE GLASS TEA CADDY,General,5.95,102
90125E,AMBER BERTIE GLASS BEAD BAG CHARM,General,1.66,110
85168B,BLACK BAROQUE CARRIAGE CLOCK,General,8.47,149
85186C,BUNNY EGG GARLAND,General,0.85,623
84926E,FLOWERS TILE COASTER,General,0.42,1068
21129,SILVER FISHING GNOME,General,6.95,151
84218,BOX/12 CHICK & EGG IN BASKET,General,1.95,217
85194S,HANGING SPRING FLOWER EGG SMALL,General,0.65,1273
22268,EASTER DECORATION SITTING BUNNY,General,1.66,2110
90037B,TINY CRYSTAL BRACELET GREEN,General,2.54,109
90041,PEARL AND CHERRY QUARTZ BRACLET,General,3.81,104
90125C,TURQUOISE BERTIE GLASS BEAD CHARM,General,1.66,176
90163A,PINK ROSEBUD & PEARL NECKLACE,General,7.64,111
90163B,WHITE ROSEBUD & PEARL NECKLACE,General,7.64,105
35911B,PINK/FLOWER RABBIT EGG WARMER,General,2.1,216
84989A,75 GREEN FAIRY CAKE CASES,General,0.55,126
79071B,ENGLISH ROSE METAL WASTE BIN,General,2.95,119
16169M,WRAP DAISY CARPET,General,0.42,735
22709,WRAP WEDDING DAY,General,0.42,1400
gift_0001_30,Dotcomgiftshop Gift Voucher £30.00,General,25.53,106
gift_0001_20,Dotcomgiftshop Gift Voucher £20.00,General,17.02,109
20785,FUSCHIA RETRO BAR STOOL,General,39.95,113
85089,CANDY SPOT BUNNY,General,2.95,111
35909A,RABBIT EASTER DECORATION,General,2.95,107
35910A,MULTICOLOUR EASTER RABBIT,General,1.95,118
21763,VINTAGE WOODEN BAR STOOL,General,29.95,104
20933,YELLOW POT PLANT CANDLE,General,3.75,121
35972,DAISY FOLKART HEART DECORATION,General,1.25,195
90155,RESIN NECKLACE W PASTEL BEADS,General,7.64,108
47589,CONGRATULATIONS BUNTING,General,5.45,112
84661A,WHITE SQUARE TABLE CLOCK,General,2.51,203
90118,PINK DAISY BAG CHARM,General,2.51,128
90182C,BLACK 3 BEAD DROP EARRINGS,General,2.96,113
21278,VINTAGE KITCHEN PRINT PUDDINGS,General,2.55,141
47518F,ICON PLACEMAT POP ART ELVIS,General,0.42,903
16156L,"WRAP, CAROUSEL",General,0.42,550
47351B,BLUE  VOILE LAMPSHADE,General,2.95,180
21084,SET/6 COLLAGE PAPER CUPS,General,0.65,2698
21088,SET/6 FRUIT SALAD PAPER CUPS,General,0.65,1766
21096,SET/6 FRUIT SALAD  PAPER PLATES,General,0.85,1347
90119,METALIC LEAVES BAG CHARMS,General,2.51,183
84741C,CITRUS GARLAND FELT FLOWERS,General,1.95,156
22266,EASTER DECORATION HANGING BUNNY,General,0.65,1982
22267,EASTER DECORATION EGG BUNNY,General,1.25,930
21003,ROSE DU SUD CUSHION COVER,General,6.35,176
21757,LIGHTHOUSE PRINTED METAL SIGN,General,4.95,104
90123B,TURQUOISE HEART OF GLASS BRACELET,General,5.95,107
90123C,GREEN HEART OF GLASS BRACELET,General,5.95,112
90122C,TURQUOISE CRYSTAL+GLASS BRACELET,General,4.95,118
90156,RESIN BRACELET W PASTEL BEADS,General,4.95,102
84617,NEW BAROQUE BLACK BOXES,General,12.75,102
21332,MOROCCAN BEATEN METAL MIRROR,General,12.75,118
35923,CANDY HEART HANGING DECORATION,General,2.51,1415
84661C,PINK SQUARE TABLE CLOCK,General,2.51,170
90038B,GLASS AND PAINTED BEADS BRACELET OL,General,3.81,112
90137,PINK COMBO MINI CRYSTALS NECKLACE,General,5.51,102
90181A,AMBER GLASS/SHELL/PEARL NECKLACE,General,9.34,106
90214W,"LETTER ""W"" BLING KEY RING",General,0.85,115
90059F,DIAMANTE HAIR GRIP PACK/2 LT ROSE,General,1.69,120
44091A,BLUE CRUSOE CHECK LAMPSHADE,General,0.42,107
21280,VINTAGE KITCHEN PRINT VEGETABLES,General,2.55,159
90037C,TINY CRYSTAL BRACELET BLUE,General,2.54,104
90122B,JADE CRYSTAL+GLASS BRACELET,General,5.09,105
35915C,PEACH KNITTED HEN,General,3.36,414
85197,SET OF 12 MINI BUNNIES IN A BUCKET,General,2.1,132
85019B,BLOSSOM  IMAGES NOTEBOOK SET,General,4.25,606
16207B,PINK HEART RED HANDBAG,General,2.95,127
20698,LITTLE PINK MONSTER SOFT TOY,General,2.55,115
47556B,TEA TIME TEA TOWELS,General,2.55,2600
79323P,PINK CHERRY LIGHTS,General,6.75,100
21655,HANGING RIDGE GLASS T-LIGHT HOLDER,General,1.69,124
35265,COLOURFUL FLOWER FRUIT BOWL,General,6.95,113
16162L,THE KING GIFT BAG,General,0.65,119
90092,BLUE CRYSTAL BOOT PHONE CHARM,General,1.66,100
90190A,SILVER/CRYSTAL DROP EARRINGS W LEAF,General,2.96,115
90011E,AMBER CRYSTAL DROP EARRINGS,General,2.96,102
90038A,GLASS AND PAINTED BEADS BRACELET TO,General,3.81,114
90079,VINTAGE ENAMEL & CRYSTAL NECKLACE,General,5.09,109
21667,GLASS CAKE COVER AND PLATE,General,14.95,100
22323,PINK POLKADOT KIDS BAG,General,1.95,100
22103,MIRROR MOSAIC T-LIGHT HOLDER ROUND,General,1.65,1359
90141D,ROSE PENDANT TRIPLE SHELL NECKLACE,General,5.51,103
85160B,BLACK BIRD GARDEN DESIGN MUG,General,16.13,205
23231,WRAP DOILEY DESIGN,General,0.42,7352
62086A,PINK RETRO BIG FLOWER BAG,General,1.95,182
90039A,FIRE POLISHED GLASS BRACELET RED,General,3.73,107
21371,MIRRORED WALL ART POPPIES,General,4.96,386
35912B,WHITE/PINK CHICK DECORATION,General,1.25,349
23230,WRAP ALPHABET DESIGN,General,0.42,8076
85206B,PINK FELT EASTER EGG BASKET,General,1.65,112
85189,HANGING BUTTERFLY  EGG,General,0.85,106
84745A,PINK HANGING GINGHAM EASTER HEN,General,0.42,126
84745B,BLUE HANGING GINGHAM EASTER HEN,General,0.42,126
90130D,RED STONE/CRYSTAL EARRINGS,General,2.9,102
21117,BLOND DOLL DOORSTOP,General,6.75,214
21459,YELLOW EASTER EGG HUNT START POST,General,1.95,170
21460,GREEN EASTER EGG HUNT START POST,General,1.95,122
37468,HARDMAN MUG 3 ASSORTED,General,7.46,164
21897,POTTING SHED CANDLE CITRONELLA,General,5.79,502
85231g,ORANGE SCENTED SET/9 T-LIGHTS,General,1.63,105
72369A,PINK CLEAR GLASS CANDLE PLATE,General,2.46,129
22967,SET 3 SONG BIRD PAPER EGGS ASSORTED,General,2.55,1173
22957,SET 3 PAPER VINTAGE CHICK PAPER EGG,General,2.55,1778
21082,SET/20 FRUIT SALAD PAPER NAPKINS,General,1.63,181
21368,MIRRORED WALL ART LADIES,General,2.55,263
17174,ASSTD RASTA KEY-CHAINS,General,0.42,108
23233,WRAP POPPIES  DESIGN,General,0.42,5250
35921,EASTER BUNNY HANGING GARLAND,General,1.25,166
85200,BUNNY EGG BOX,General,1.25,281
84231,EASTER BUNNY WITH BASKET ON BACK,General,0.65,207
21461,BLUE EASTER EGG HUNT START POST,General,1.95,106
84462,3 PINK HEN+CHICKS IN BASKET,General,1.25,110
84461,12 PINK HEN+CHICKS IN BASKET,General,2.55,140
35922,EASTER BUNNY WREATH,General,4.95,127
84675,FROG KING WATERING CAN,General,2.95,104
47469,ASSORTED SHAPES PHOTO CLIP SILVER,General,0.65,561
23232,WRAP VINTAGE PETALS  DESIGN,General,0.42,8701
84905,PINK BUTTERFLY CUSHION COVER,General,4.95,131
84806B,WHITE CANDYSTUFT ARTIFICIAL FLOWER,General,1.45,402
21458,2 PICTURE BOOK EGGS EASTER BUNNY,General,1.25,273
85198,ASSORTED FARMYARD ANIMALS IN BUCKET,General,0.85,176
90191,SILVER LARIAT 40CM,General,12.48,125
84796B,BLUE SAVANNAH PICNIC HAMPER FOR 2,General,24.96,355
23166,MEDIUM CERAMIC TOP STORAGE JAR,General,1.04,78033
20845,ZINC HEART LATTICE 2 WALL PLANTER,General,6.35,118
84033,FLAG OF ST GEORGE,General,1.65,122
85040a,S/4 PINK FLOWER CANDLES IN BOWL,General,3.29,131
20795,LARGE BLUE PROVENCAL CERAMIC BALL,General,4.13,148
47590b,PINK HAPPY BIRTHDAY BUNTING,General,10.79,110
72807a,SET/3 ROSE CANDLE IN JEWELLED BOX,General,8.29,107
84226,HEN HOUSE W FAMILY IN BARN & NEST,General,0.85,149
21926,RED/CREAM STRIPE CUSHION COVER,General,1.25,512
37379A,PINK CHERRY BLOSSOM CUP & SAUCER,General,1.25,100
35920,FOUR RABBIT EASTER DECORATIONS,General,1.25,162
84801A,PINK HYDRANGEA ART FLOWER,General,2.1,134
84592,CROCHET ROSE PURSE WITH SUEDE BACK,General,2.95,170
84800S,SMALL WHITE/PINK ROSE ART FLOWER,General,1.25,207
79192A,RETRO PLASTIC 70'S TRAY,General,1.25,102
85130C,BEADED CRYSTAL HEART BLUE  LARGE,General,1.65,559
20756,GREEN FERN POCKET BOOK,General,0.85,160
21320,GLASS CHALICE GREEN  LARGE,General,4.96,296
90027C,GLASS BEAD HOOP EARRINGS GREEN,General,2.9,104
90202B,WHITE ENAMEL FLOWER HAIR TIE,General,2.9,115
22125,UNION JACK HOT WATER BOTTLE,General,12.46,112
40046A,RED DAISY PAPER LAMPSHADE,General,1.25,147
85188A,GREEN METAL SWINGING BUNNY,General,1.63,418
84527,FLAMES SUNGLASSES PINK LENSES,General,1.95,144
72799C,PINK PILLAR CANDLE SILVER FLOCK,General,2.95,180
71101E,STANDING FAIRY POLE SUPPORT,General,0.85,436
21457,2 PICTURE BOOK EGGS EASTER DUCKS,General,1.25,223
21456,2 PICTURE BOOK EGGS EASTER CHICKS,General,1.25,269
35647,VINTAGE BEAD PINK SHADE,General,1.25,101
84632,DECORATIVE HANGING SHELVING UNIT,General,59.95,105
72801c,4 ROSE PINK DINNER CANDLES,General,2.46,138
22764,"RUSTIC WOODEN CABINET, GLASS DOORS",General,49.96,103
90037A,TINY CRYSTAL BRACELET RED,General,2.48,100
35913B,WHITE/PINK CHICK EASTER DECORATION,General,0.85,132
22146,EASTER CRAFT IVY WREATH WITH CHICK,General,1.95,100
85047,WHITE BEADED GARLAND STRING 20LIGHT,General,6.35,102
21476,STEEL SWEETHEART ROUND TABLE CREAM,General,14.95,140
37351,ORANGE FLOWER MUG,General,1.25,104
85160A,WHITE BIRD GARDEN DESIGN MUG,General,1.25,100
84997a,GREEN 3 PIECE POLKADOT CUTLERY SET,General,8.29,205
21344,MOROCCAN BEATEN METAL DISH,General,20.79,114
84974,S/2 ZINC HEART DESIGN PLANTERS,General,9.95,139
72821,CUPID SCENTED CANDLE IN GLASS,General,1.65,109
90123D,WHITE HEART OF GLASS BRACELET,General,5.95,105
90123A,PINK HEART OF GLASS BRACELET,General,5.95,114
90148,LONG SILVER NECKLACE PASTEL FLOWER,General,12.75,108
90016B,GOLD/M.O.P PENDANT ORBIT NECKLACE,General,8.5,121
90016A,SILVER/M.O.P PENDANT ORBIT NECKLACE,General,8.5,114
84847,FLORAL BATHROOM SET,General,3.75,120
20898,VINTAGE NOTEBOOK TRAVELOGUE,General,2.95,126
90183C,BLACK DROP EARRINGS W LONG BEADS,General,2.9,108
DCGS0069,OOH LA LA DOGS COLLAR,General,15.79,100
84465,15 PINK FLUFFY CHICKS IN BOX,General,2.95,108
20851,ZINC HEART LATTICE TRAY OVAL,General,5.95,107
84715,SET OF 6 ICE CREAM SKITTLES,General,2.95,108
84919,BLUE CUSHION COVER WITH FLOWER,General,6.95,156
84907,PINK YELLOW PATCH CUSHION COVER,General,7.65,127
85024B,EAU DE NILE JEWELLED PHOTOFRAME,General,1.65,290
35637C,PINK STRING CURTAIN WITH POLE,General,19.13,129
71496B,A4 WALL TIDY RED FLOWERS,General,0.65,109
17028J,INCENSE BAZAAR PEACH,General,0.42,100
17084A,TRANQUILITY MASALA INCENSE,General,0.21,250
84795C,OCEAN STRIPE HAMMOCK,General,7.95,100
62074B,ELEPHANT CLIP W SUCTION CUP,General,0.42,106
84279B,CHERRY BLOSSOM DECORATIVE FLASK,General,3.75,291
84801B,WHITE HYDRANGEA ART FLOWER,General,2.1,116
84805A,CREAM CLIMBING HYDRANGA ART FLOWER,General,3.75,126
17136A,BLUE STONES ON WIRE FOR CANDLE,General,0.21,500
84993a,75 GREEN PETIT FOUR CASES,General,0.83,131
72807b,SET/3 OCEAN SCENT CANDLE JEWEL BOX,General,8.29,103
84509b,SET OF 4 FAIRY CAKE PLACEMATS,General,7.46,103
84708B,PINK JEWELLED PHOTO FRAME,General,4.95,158
44089A,PINK GAUZE BUTTERFLY LAMPSHADE,General,0.42,111
84723,CHERRY BLOSSOM CANVAS ART PICTURE,General,7.95,140
22038,BOTANICAL LAVENDER GIFT WRAP,General,0.42,550
90098,NECKLACE+BRACELET PINK BUTTERFLY,General,2.55,123
15058C,ICE CREAM DESIGN GARDEN PARASOL,General,7.95,336
22989,SET 2 PANTRY DESIGN TEA TOWELS,General,2.95,2909
84968d,SET OF 16 VINTAGE RED CUTLERY,General,24.96,102
84509a,SET OF 4 ENGLISH ROSE PLACEMATS,General,7.46,203
84452,METAL RABBIT LADDER EASTER,General,0.85,162
22353,LUNCH BOX WITH CUTLERY FAIRY CAKES,General,2.55,160
22990,COTTON APRON PANTRY DESIGN,General,4.95,734
85092,CANDY SPOT TEA COSY,General,3.35,124
37413,ICON MUG REVOLUTIONARY,General,1.25,797
DCGSSBOY,BOYS PARTY BAG,General,3.29,146
DCGSSGIRL,GIRLS PARTY BAG,General,3.29,144
35815P,"ACRYLIC JEWEL SNOWFLAKE, PINK",General,2.1,261
21228,"POCKET MIRROR ""GLAMOROUS""",General,1.25,104
84536a,ENGLISH ROSE NOTEBOOK A7 SIZE,General,0.79,113
72812,LARGE ZINC GLASS CANDLEHOLDER,General,4.13,132
82001s,VINYL RECORD FRAME SILVER,General,7.46,221
79063D,"RETRO PILL BOX , REVOLUTIONARY",General,0.42,289
75172,PAINTED SEA SHELL METAL WINDCHIME,General,3.75,191
45013,FOLDING SHOE TIDY,General,2.95,101
21636,MADRAS NOTEBOOK MEDIUM,General,2.55,1013
71510,SQUARE METAL CANDLEHOLDER BASE,General,0.85,140
44265,M/COLOUR POM-POM CURTAIN,General,4.25,100
79323B,BLACK CHERRY LIGHTS,General,6.75,100
